Inspection ID,DBA Name,AKA Name,License #,Facility Type,Risk,Address,City,State,Zip,Inspection Date,Inspection Type,Results,Violations,Latitude,Longitude,Location
1068208,CHINA COURT RESTAURANT,CHINA COURT RESTAURANT,2141795,Restaurant,Risk 1 (High),1146 N MILWAUKEE AVE,CHICAGO,IL,60642,03/14/2012,License Re-Inspection,Fail,"18. NO EVIDENCE OF RODENT OR INSECT OUTER OPENINGS PROTECTED/RODENT PROOFED, A WRITTEN LOG SHALL BE MAINTAINED AVAILABLE TO THE INSPECTORS - Comments: FOUND NO PEST CONTROL LOG BOOK ON PREMISES,FRONT/REAR DOORS TO PREMISES WITH 1/4"" MODE OF ENTRY.MUST PROVIDE PEST CONTROL LOG BOOK,RODENT PROOF SAID DOORS ALL ACROSS THE BOTTOMS. | 32. FOOD AND NON-FOOD CONTACT SURFACES PROPERLY DESIGNED, CONSTRUCTED AND MAINTAINED - Comments: SPLASHGUARD AT FRONT EXPOSED HANDSINK IS MISSING MUST PROVIDE,SINK STOPPERS ARE NEEDED FOR THE 3 COMPARTMENT SINK.   | 41. PREMISES MAINTAINED FREE OF LITTER, UNNECESSARY ARTICLES, CLEANING  EQUIPMENT PROPERLY STORED - Comments: DETAIL CLEAN,ORGANIZE REAR STORAGE AREAS AND REMOVE ALL CLUTTER/UNUSED KITCHEN EQUIPMENTS DUE TO POTENTIAL PEST HARBORAGE.",41.902462266949634,-87.66530609467256,"(41.902462266949634, -87.66530609467256)"
1072213,CUDDLE CARE,CUDDLE CARE,1622366,Daycare Above and Under 2 Years,Risk 1 (High),4800 S LAKE PARK AVE,CHICAGO,IL,60615,10/22/2012,Canvass,Pass,"31. CLEAN MULTI-USE UTENSILS AND SINGLE SERVICE ARTICLES PROPERLY STORED: NO REUSE OF SINGLE SERVICE ARTICLES - Comments: INVERT ALL MULTI-USE UTENSILS IN KITCHEN. | 32. FOOD AND NON-FOOD CONTACT SURFACES PROPERLY DESIGNED, CONSTRUCTED AND MAINTAINED - Comments: REPAIR BROKEN  CABINET DOORS/DRAWERS IN KITCHEN.  | 35. WALLS, CEILINGS, ATTACHED EQUIPMENT CONSTRUCTED PER CODE: GOOD REPAIR, SURFACES CLEAN AND DUST-LESS CLEANING METHODS - Comments: REPLACE ALL STAINED CEILING TILES IN KITCHEN AND STUDENT WASHROOM. | 41. PREMISES MAINTAINED FREE OF LITTER, UNNECESSARY ARTICLES, CLEANING  EQUIPMENT PROPERLY STORED - Comments: REMOVE ALL UNNECESSARY CLUTTER IN NORTH HALLWAY CLOSET.STORE 6"" OFF FLOOR, ORGANIZE AND MAINTAIN AT ALL TIMES.",41.80792179224785,-87.5906931090992,"(41.80792179224785, -87.5906931090992)"
1072214,CUDDLE CARE,CUDDLE CARE,1622365,Daycare Above and Under 2 Years,Risk 1 (High),4800 S LAKE PARK AVE,CHICAGO,IL,60615,10/22/2012,Canvass,Pass,"31. CLEAN MULTI-USE UTENSILS AND SINGLE SERVICE ARTICLES PROPERLY STORED: NO REUSE OF SINGLE SERVICE ARTICLES - Comments: INVERT ALL MULTI-USE UTENSILS IN KITCHEN.  | 32. FOOD AND NON-FOOD CONTACT SURFACES PROPERLY DESIGNED, CONSTRUCTED AND MAINTAINED - Comments: REPAIR BROKEN CABINET DOORS/DRAWERS IN KITCHEN.  | 35. WALLS, CEILINGS, ATTACHED EQUIPMENT CONSTRUCTED PER CODE: GOOD REPAIR, SURFACES CLEAN AND DUST-LESS CLEANING METHODS - Comments: REPLACE ALL STAINED CEILING TILES IN KITCHEN AND STUDENT WASHROOM.  | 41. PREMISES MAINTAINED FREE OF LITTER, UNNECESSARY ARTICLES, CLEANING  EQUIPMENT PROPERLY STORED - Comments: REMOVE ALL UNNECESSARY CLUTTER IN NORTH HALLWAY CLOSET.STORE 6"" OFF FLOOR, ORGANIZE AND MAINTAIN AT ALL TIMES.",41.80792179224785,-87.5906931090992,"(41.80792179224785, -87.5906931090992)"
1072228,SHARKS FISH & CHICKEN,SHARKS FISH & CHICKEN,2069562,Restaurant,Risk 2 (Medium),101 E 51ST ST,CHICAGO,IL,60615,10/26/2012,Short Form Complaint,Pass,"34. FLOORS: CONSTRUCTED PER CODE, CLEANED, GOOD REPAIR, COVING INSTALLED, DUST-LESS CLEANING METHODS USED - Comments: REMOVE POOLING WATER IN WALK-IN COOLER, KEEP DRY AT ALL TIMES. | 41. PREMISES MAINTAINED FREE OF LITTER, UNNECESSARY ARTICLES, CLEANING  EQUIPMENT PROPERLY STORED - Comments: STORE ALL FOOD ITEMS IN WALK-IN COOLER 6"" OFF FLOOR. MUST ELEVATE.",41.80189221533366,-87.62256558837282,"(41.80189221533366, -87.62256558837282)"
1072252,SALAAM RESTAURANT AND BAKERY,SALAAM RESTAURANT AND BAKERY,2141327,Restaurant,Risk 1 (High),700-706 W 79TH ST,CHICAGO,IL,60620,01/24/2013,Canvass,Pass,"33. FOOD AND NON-FOOD CONTACT EQUIPMENT UTENSILS CLEAN, FREE OF ABRASIVE DETERGENTS - Comments: CLEAN THE FOLLOWING: INTERIOR BOTTOM CABINETS OF DEEP FRYER ON 1ST AND 2ND FLOORS,EXTERIOR OF ALL COOKING EQUIPMENT ON 2ND FLOOR. MUST CLEAN,  ORGANIZE AND MAINTAIN AT ALL TIMES.   | 34. FLOORS: CONSTRUCTED PER CODE, CLEANED, GOOD REPAIR, COVING INSTALLED, DUST-LESS CLEANING METHODS USED - Comments: MUST CLEAN FLOORS IN STAIRWAYS, ON SECOND FLOOR AT CORNERS AND ALONG WALL BASE IN PREP AREA AND WHERE NECESSARY. MUST CLEAN AND MAINTAIN AT ALL TIMES. | 35. WALLS, CEILINGS, ATTACHED EQUIPMENT CONSTRUCTED PER CODE: GOOD REPAIR, SURFACES CLEAN AND DUST-LESS CLEANING METHODS - Comments: SERVICE DOOR FOR ELEVATOR ON EAST SIDE OF BUILDING NEEDS WEATHER STRIPPING DOWN THE MIDDLE TO PREVENT PEST ENTRY. ELEVATE PRODUCTS 6"" OFF FLOOR IN DRY GOODS STORAGE AREA. | 36. LIGHTING: REQUIRED MINIMUM FOOT-CANDLES OF LIGHT PROVIDED, FIXTURES SHIELDED - Comments: LIGHT SHIELDS MISSING IN UPSTAIRS WALK-IN COOLER AND FREEZER. MUST PROVIDE. | 41. PREMISES MAINTAINED FREE OF LITTER, UNNECESSARY ARTICLES, CLEANING  EQUIPMENT PROPERLY STORED - Comments: REMOVE CLUTTER UNDER STAIRS OFF OF BAKERY AREA. MUST REMOVE AND MAINTAIN AT ALL TIMES.",41.750787498480555,-87.64166664542023,"(41.750787498480555, -87.64166664542023)"
1072529,GRESHAM ELEMENTARY SCHOOL,GRESHAM ELEMENTARY SCHOOL,23451,School,Risk 1 (High),8524 S Green (832W),CHICAGO,IL,60620,09/05/2013,Canvass,Fail,"12. HAND WASHING FACILITIES: WITH SOAP AND SANITARY HAND DRYING DEVICES, CONVENIENT AND ACCESSIBLE TO FOOD PREP AREA - Comments: NO SOAP FOR HAND WASHING IN STAFF RESTROOM. INSTRUCTED TO PROVIDE.  CRITICAL VIOLATION 7-38-030.  | 18. NO EVIDENCE OF RODENT OR INSECT OUTER OPENINGS PROTECTED/RODENT PROOFED, A WRITTEN LOG SHALL BE MAINTAINED AVAILABLE TO THE INSPECTORS - Comments: OBSERVED 30 MICE DROPPINGS UNDER RACKS, ON TOP OF BULK CONTAINERS AND AGAINST WALL IN DRY FOOD PANTRY AREA, AND IN LUNCHROOM. ALSO NOTED DOOR #3 NOT RODENT PROOF WITH 1/2"" GAP DOWN THE CENTER AND AT BOTTOM. REMOVE DROPPINGS CLEAN AND SANITIZE AFFECTED AREAS, SEAL DOOR. SERIOUS VIOLATION 7-38-020. | 34. FLOORS: CONSTRUCTED PER CODE, CLEANED, GOOD REPAIR, COVING INSTALLED, DUST-LESS CLEANING METHODS USED - Comments: CLEAN/SANITIZE FLOORS IN KITCHEN, LUNCHROOM AND PANTRY. MAINTAIN AT ALL TIMES.",41.73891334027122,-87.6450616939937,"(41.73891334027122, -87.6450616939937)"
1084236,THE JIBARITO STOP,THE JIBARITO STOP,2156722,Mobile Food Dispenser,Risk 3 (Low),2007-2009 S DAMEN AVE,CHICAGO,IL,60608,05/25/2012,License,Fail,"18. NO EVIDENCE OF RODENT OR INSECT OUTER OPENINGS PROTECTED/RODENT PROOFED, A WRITTEN LOG SHALL BE MAINTAINED AVAILABLE TO THE INSPECTORS - Comments: THE REAR PASSENGER SIDE OF THE TRUCK HAS AN OPEN LOUVER VENT WITH 1/4"" OPENINGS, ATTACH A SCREEN TO KEEP OUT INSECTS/PESTS. | 32. FOOD AND NON-FOOD CONTACT SURFACES PROPERLY DESIGNED, CONSTRUCTED AND MAINTAINED - Comments: THE SERVING COUNTERS ARE BLACK METAL COVERED WITH CONTACT PAPER, THE COUNTERS MUST BE CONSTRUCTED OF A SMOOTH AND SANITARY SURFACE. | 34. FLOORS: CONSTRUCTED PER CODE, CLEANED, GOOD REPAIR, COVING INSTALLED, DUST-LESS CLEANING METHODS USED - Comments: THE FLOORS ARE ROUGH IN SPOTS AND DIRTY, REMOVE THE CORROSION, CLEAN THE FLOORS AND FILL IN THE SMALL HOLES AT THE REAR OF THE COMPARTMENT.",41.854694701707345,-87.67576513516751,"(41.854694701707345, -87.67576513516751)"
1084239,MANJARES AL EXPRESS,MANJARES AL EXPRESS,2021538,Restaurant,Risk 1 (High),2226-2230 S ASHLAND AVE,CHICAGO,IL,60608,05/29/2012,Complaint,Fail,"2. FACILITIES TO MAINTAIN PROPER TEMPERATURE - Comments: THE SOUTH FRONT KITCHEN PREP COOLER HAS AN AMBIENT AIR TEMPERATURE OF 54 F, COOLER TAGGED HELD FOR INSPECTION UNTIL REPAIRED OR REPLACED. | 3. POTENTIALLY HAZARDOUS FOOD MEETS TEMPERATURE REQUIREMENT DURING STORAGE, PREPARATION DISPLAY AND SERVICE - Comments: 4 PANS OF COOKED FISH AND SEAFOOD SALADS AND A PACKAGE OF IMITATION CRAB ARE BEING HELD AT 53 F TO 55.3 F INTERNAL TEMPERATURE.    4 POUNDS OF PRODUCT VALUED AT $30 WAS DISCARDED AT THIS TIME. | 8. SANITIZING RINSE FOR EQUIPMENT AND UTENSILS:  CLEAN, PROPER TEMPERATURE, CONCENTRATION, EXPOSURE TIME - Comments: THE LOW TEMPERATURE DISHMACHINE BEING USED AT THIS TIME HAS NO SANITIZING RINSE CHEMICAL DETECTED IN THE FINAL RINSE, MACHINE TAGGED HELD FOR INSPECTION AND CANNOT BE USED UNTIL REINSPECTED.    THE THREE COMPARTMENT SINK IN THE BAR AREA IS BEING USED TO WASH GLASSES WITH ONLY THE CENTER COMPARTMENT.    A THREE COMPARTMENT SINK MUST BE SET UP WITH SOAP AND WATER, A CLEAN WATER RINSE AND A FINAL SANITIZING RINSE IN ORDER TO INSURE PROPER SANITATION. | 10. SEWAGE AND WASTE WATER DISPOSAL, NO BACK SIPHONAGE, CROSS  CONNECTION AND/OR BACK FLOW - Comments: THE NORTH KITCHEN EXPOSED HAND SINK DRAIN LEAKS INTO A BUCKET, SINK SHUT DOWN AT THIS TIME.  AN ALTERNATE HANDSINK ON THE SOUTH WALL OF THE KITCHEN IS WORKING PROPERLY AND IS ACCESSIBLE. | 18. NO EVIDENCE OF RODENT OR INSECT OUTER OPENINGS PROTECTED/RODENT PROOFED, A WRITTEN LOG SHALL BE MAINTAINED AVAILABLE TO THE INSPECTORS - Comments: OVER 20 LIVE SMALLFLIES WERE FOUND IN THE DIRTY DRAINS AND WET AREA UNDER THE LEAKING NORTH EXPOSED HAND SINK.    OVER 30 LIVE ANTS WERE FOUND IN THE MOP SINK AND ATTACHED BASEBOARD AREA.    A 1"" HOLE IN THE CORNER OF THE SOUTHWEST KITCHEN BASEBOARD GOES OUTSIDE, PEST PROOF THE OUTER OPENING AND REMOVE ALL EVIDENCE OF PEST ACTIVITY. | 24. DISH WASHING FACILITIES: PROPERLY DESIGNED, CONSTRUCTED, MAINTAINED, INSTALLED, LOCATED AND OPERATED - Comments: THE BAR THREE COMPARTMENT SINK HAS A MOLD COATED CAULKED SEAM INSIDE OF THE EAST COMPARTMENT.   HAVE THE STAINLESS STEEL SINK WELDED WITH STAINLESS STEEL AND GROUND SMOOTH, REPLACED OR REMOVED.  SINK TAGGED HELD FOR INSPECTION. | 34. FLOORS: CONSTRUCTED PER CODE, CLEANED, GOOD REPAIR, COVING INSTALLED, DUST-LESS CLEANING METHODS USED - Comments: THE FLOORS ARE DIRTY THROUGHOUT THE KITCHEN AND WALK IN COOLER INTERIORS; WASH, RINSE AND SANITIZE THE FLOORS UNTIL THEY ARE CLEAN FROM CORNER TO CORNER. | 35. WALLS, CEILINGS, ATTACHED EQUIPMENT CONSTRUCTED PER CODE: GOOD REPAIR, SURFACES CLEAN AND DUST-LESS CLEANING METHODS - Comments: THE KITCHEN WALLS AND CEILINGS ARE DIRTY, CLEAN THE WALLS AND CEILINGS FROM TOP TO BOTTOM AND REPAINT WITH LIGHT COLORS AS NEEDED. | 36. LIGHTING: REQUIRED MINIMUM FOOT-CANDLES OF LIGHT PROVIDED, FIXTURES SHIELDED - Comments: THE REAR WALK IN COOLER HAS A MISSING LIGHT SHIELD, REPLACE THE MISSING SHIELD AND REPLACE THE MISSING END CAPS IN THE DISHROOM LIGHT BULB SHIELDS.",41.851397799712196,-87.66616621226514,"(41.851397799712196, -87.66616621226514)"
1084242,CHISCREAM,CHISCREAM,2152278,Mobile Food Dispenser,Risk 3 (Low),324 N LEAVITT ST,CHICAGO,IL,60612,06/04/2012,License,Fail,"1. SOURCE SOUND CONDITION, NO SPOILAGE, FOODS PROPERLY LABELED, SHELLFISH TAGS IN PLACE - Comments: THE CART HAS NO ADDRESS ON THE OUTSIDE, ADD THE ADDRESS OF THE BUSINESS IN 2"" LETTERING. | 16. FOOD PROTECTED DURING STORAGE, PREPARATION, DISPLAY, SERVICE AND TRANSPORTATION - Comments: THE LID IS AN ELASTIC BANDED TARP, THE TOP NEEDS TO BE CONSTRUCTED OUT OF A DURABLE, EASY TO CLEAN SURFACE. | 32. FOOD AND NON-FOOD CONTACT SURFACES PROPERLY DESIGNED, CONSTRUCTED AND MAINTAINED - Comments: THE CART INSULATED BOX HAS ROUGH, UNSANITARY EDGES, SEAL THE EDGES SO THEY ARE SMOOTH, SANITARY AND EASY TO MAINTAIN.",41.88743405025222,-87.68184949426895,"(41.88743405025222, -87.68184949426895)"
1084254,DELANO ELEMENTARY,DELANO ELEMENTARY,22911,School,Risk 1 (High),3937 W Wilcox St (132S),CHICAGO,IL,60624,06/11/2012,Canvass,Pass,"33. FOOD AND NON-FOOD CONTACT EQUIPMENT UTENSILS CLEAN, FREE OF ABRASIVE DETERGENTS - Comments: THE 2-DOOR FRONT LINE COOLER IS ICED UP, DEFROST AND MAINTAIN SAID COOLER. | 34. FLOORS: CONSTRUCTED PER CODE, CLEANED, GOOD REPAIR, COVING INSTALLED, DUST-LESS CLEANING METHODS USED - Comments: THE FLOORS ARE DIRTY UNDER THE THREE COMPARTMENT SINK AND IN FRONT OF THE DOUGH MIXER OF THE MAIN KITCHEN AND INSIDE OF THE HEADSTART HALLWAY CLOSETS.  CLEAN THE FLOORS FROM CORNER TO CORNER. | 35. WALLS, CEILINGS, ATTACHED EQUIPMENT CONSTRUCTED PER CODE: GOOD REPAIR, SURFACES CLEAN AND DUST-LESS CLEANING METHODS - Comments: THE WALLS IN THE FIRST AND SECOND FLOOR GIRLS WASHROOMS ARE ROUGH CONCRETE AND BRICK, SMOOTH OUT THE WALL TO EASY CLEANING.    THE CEILING IN THE FIRST FLOOR BOYS WASHROOM IS WATER DAMAGED, REPAIR THE WATER DAMAGED WALL SO IT IS SMOOTH AND SANITARY. | 38. VENTILATION: ROOMS AND EQUIPMENT VENTED AS REQUIRED: PLUMBING: INSTALLED AND MAINTAINED - Comments: THERE ARE OUT OF ORDER TOILETS IN THE ""O"" SIDE GIRLS AND SECOND FLOOR GIRLS WASHROOMS, PARTS ARE ON ORDER, REPAIR ALL OUT OF ORDER PLUMBING.    THE KITCHEN FLOORS HAVE DIRTY DRAINS AND SMALL HOLES, SEAL UP UNESSESARY HOLES AND GAPS AND CLEAN AND MAINTAIN THE DRAINS.",41.87877166307884,-87.72464874852157,"(41.87877166307884, -87.72464874852157)"
1084269,TORTERIA LAS FUTBOLERAS,TORTERIA LAS FUTBOLERAS,1578487,Restaurant,Risk 1 (High),2152 W CERMAK RD,CHICAGO,IL,60608,06/25/2012,Complaint,Fail,"6. HANDS WASHED AND CLEANED, GOOD HYGIENIC PRACTICES; NO BARE HAND CONTACT WITH READY-TO-EAT FOODS. - Comments: EMPLOYEES WERE OBSERVED NOT WASHING HANDS IN BETWEEN HANDLING DIRTY TOWELS AND SHELL EGGS AND READY TO EAT FOOD AND OPENING COOLER DOORS, THE COOLER HANDLES HAVE A 1/4"" BUILDUP OF FOOD ON THEM.  OBSERVE GOOD HANDWASHING PRACTICES AND MINIMIZE BAERE HAND CONTACT WITH READY TO EAT FOOD.  WASH HANDS WHEN THEY ARE DIRTY AND IN BETWEEN JOBS. | 18. NO EVIDENCE OF RODENT OR INSECT OUTER OPENINGS PROTECTED/RODENT PROOFED, A WRITTEN LOG SHALL BE MAINTAINED AVAILABLE TO THE INSPECTORS - Comments: 5 LIVE COCKROACHES WERE FOUND UNDER THE KITCHEN SINK BACKSPLASH, REMOVE ALL EVIDENCE OF PESTS. | 31. CLEAN MULTI-USE UTENSILS AND SINGLE SERVICE ARTICLES PROPERLY STORED: NO REUSE OF SINGLE SERVICE ARTICLES - Comments: THE KNIVES ARE STORED IN AN UNSANITARY HOLDER WITH FOOD ON THE BLADES, THE CUTTING BOARDS ARE STAINED AND UNSANITARY.  CLEAN, RINSE AND SANITIZE THE KNIVES AND BOARDS. | 33. FOOD AND NON-FOOD CONTACT EQUIPMENT UTENSILS CLEAN, FREE OF ABRASIVE DETERGENTS - Comments: THE MEAT SLICER IS DIRTY; WASH, RINSE AND SANITIZE THE MEAT SLICER IN DETAIL IN BETWEEN USE.  | 34. FLOORS: CONSTRUCTED PER CODE, CLEANED, GOOD REPAIR, COVING INSTALLED, DUST-LESS CLEANING METHODS USED - Comments: THE FLOOR BASEBOARDS BEHIND THE PREP COOLER AND ORDER WINDOW IS PULLED AWAY FROM THE WALL AND THE FLOORS ARE DIRTY, CLEAN AND REPAIR UNTIL THE FLOORS ARE CLEAN.",41.85221316094893,-87.68039534069054,"(41.85221316094893, -87.68039534069054)"
1084275,THE JAM HOUSE,,2162186,Restaurant,Risk 2 (Medium),1854 W 18TH ST,CHICAGO,IL,60608,06/28/2012,License,Fail,"10. SEWAGE AND WASTE WATER DISPOSAL, NO BACK SIPHONAGE, CROSS  CONNECTION AND/OR BACK FLOW - Comments: THE BASEMENT FLOOR IS FULL OF WATER AND DIRTY, CLEAN THE FLOOR AND REPAIR THE PLUMBING LEAK.    NO MOP SINK ON PREMISES, INSTALL A MOP SINK. | 18. NO EVIDENCE OF RODENT OR INSECT OUTER OPENINGS PROTECTED/RODENT PROOFED, A WRITTEN LOG SHALL BE MAINTAINED AVAILABLE TO THE INSPECTORS - Comments: THE REAR BASEMENT DOOR HAS A 3"" GAP AT THE BOTTOM, REPAIR THE DOOR SO PEST PROOF. | 24. DISH WASHING FACILITIES: PROPERLY DESIGNED, CONSTRUCTED, MAINTAINED, INSTALLED, LOCATED AND OPERATED - Comments: THE THREE COMPARTMENT SINK HAS NO ATTACHED METAL DRAINBOARD, INSTALL A STAINLESS STEEL ATTACHED METAL DRAINBOARD. | 34. FLOORS: CONSTRUCTED PER CODE, CLEANED, GOOD REPAIR, COVING INSTALLED, DUST-LESS CLEANING METHODS USED - Comments: THE BASEBOARDS ARE FULL OF UNSANITARY GAPS, RESEAL THE BASEBOARDS SO THEY ARE SMOOTH AND SANITARY. | 35. WALLS, CEILINGS, ATTACHED EQUIPMENT CONSTRUCTED PER CODE: GOOD REPAIR, SURFACES CLEAN AND DUST-LESS CLEANING METHODS - Comments: THE PREP AREA HAS UNSANITARY BRICK WALLS, THE WALLS MUST BE SMOOTH, SANITARY AND EASY TO MAINTAIN. | 37. TOILET ROOM DOORS SELF CLOSING: DRESSING ROOMS WITH LOCKERS PROVIDED: COMPLETE SEPARATION FROM LIVING/SLEEPING QUARTERS - Comments: THE BATHROOM DOOR IS NOT SELF CLOSING, INSTALL A SELF CLOSING DEVICE.",41.85780570258303,-87.67327895610481,"(41.85780570258303, -87.67327895610481)"
1084320,"PEAPOD, LLC.",PEAPOD,2177217,Wholesale,Risk 3 (Low),2300 S THROOP ST,CHICAGO,IL,60608,07/25/2012,License,Fail,"2. FACILITIES TO MAINTAIN PROPER TEMPERATURE - Comments: NO REFRIGERATION ON PREMISES, ADEQUATE REFRIGERATION MUST BE AVAILABLE TO KEEP POTENTIALLY HAZARDOUS FOODS AT 40f OR LESS AND FROZEN FOODS AT 0f OR LESS. | 18. NO EVIDENCE OF RODENT OR INSECT OUTER OPENINGS PROTECTED/RODENT PROOFED, A WRITTEN LOG SHALL BE MAINTAINED AVAILABLE TO THE INSPECTORS - Comments: THE DOCK DOORS AND COMMON ENTRY WAY HAS 1/4"" AND LARGER GAPS, PEST PROOF ALL OUTER OPENINGS.  | 34. FLOORS: CONSTRUCTED PER CODE, CLEANED, GOOD REPAIR, COVING INSTALLED, DUST-LESS CLEANING METHODS USED - Comments: THE FLOORS ARE DIRTY IN THE BASEMENT BREAK AREA AND DOCK, THE FLOORS NEED TO BE CLEANED IN DETAIL. | 35. WALLS, CEILINGS, ATTACHED EQUIPMENT CONSTRUCTED PER CODE: GOOD REPAIR, SURFACES CLEAN AND DUST-LESS CLEANING METHODS - Comments: SOME DAMAGED CEILING SECTIONS AND PEELING PAINT ON THE I BEAMS WAS FOUND, REPAIR THE WALL CEILINGS SO THEY ARE SMOOTH AND SANITARY. | 38. VENTILATION: ROOMS AND EQUIPMENT VENTED AS REQUIRED: PLUMBING: INSTALLED AND MAINTAINED - Comments: ONE OF THE FOUR TOILETS IS OUT OF ORDER, REPAIR THE TOILET.  ONE SET OF FAUCET HANDLES IS MISSING ON THE BATHROOM HANDSINK, REPAIR THE FAUCET OR REMOVE IT.",41.85045102427,-87.65879785567869,"(41.85045102427, -87.65879785567869)"
1084358,SUCCEZZ,,2098980,Liquor,Risk 3 (Low),2201 W WALNUT ST,CHICAGO,IL,60612,09/04/2012,License,Fail,"8. SANITIZING RINSE FOR EQUIPMENT AND UTENSILS:  CLEAN, PROPER TEMPERATURE, CONCENTRATION, EXPOSURE TIME - Comments: THE DISHMACHINE IS NOT CONNECTED, HAVE THE MACHINE READY FOR REINSPECTION. | 18. NO EVIDENCE OF RODENT OR INSECT OUTER OPENINGS PROTECTED/RODENT PROOFED, A WRITTEN LOG SHALL BE MAINTAINED AVAILABLE TO THE INSPECTORS - Comments: THE REAR DOOR HAS A 1"" GAP AT THE BOTTOM, RODENT PROOF OUTER OPENINGS. | 33. FOOD AND NON-FOOD CONTACT EQUIPMENT UTENSILS CLEAN, FREE OF ABRASIVE DETERGENTS - Comments: THE ICE MACHINE IS NOT ON PREMISES, INSTALL WITH BACKFLOW PREVENTION PER CITY CODE. | 35. WALLS, CEILINGS, ATTACHED EQUIPMENT CONSTRUCTED PER CODE: GOOD REPAIR, SURFACES CLEAN AND DUST-LESS CLEANING METHODS - Comments: THE BAR NEEDS BASEBORADS, INSTALL TIGHT FITTING BASEBOARDS.",41.88567164152838,-87.68177223280703,"(41.88567164152838, -87.68177223280703)"
1084366,BIRRIERIA Y TAQUERIA EL CHIVO FELIZ INC.,BIRRIERIA Y TAQUERIA EL CHIVO FELIZ INC.,1942781,Restaurant,Risk 1 (High),2023 S WESTERN AVE,CHICAGO,IL,60608,09/10/2012,Complaint,Fail,"16. FOOD PROTECTED DURING STORAGE, PREPARATION, DISPLAY, SERVICE AND TRANSPORTATION - Comments: UNPROTECTED/UNCOVERED FOODS ARE STORED INSIDE OF THE FRONT PREP COOLER, REAR KITCHEN 2-DOOR COOLER AND REAR THREE DOOR COOLER THAT ARE DIRTY AND UNSANITARY INSIDE WITH DIRTY, RUSTY SHELVING AND ENCRUSTED WITH SPILLED BLOOD.  WASH, RINSE AND SANITIZE THE COOLERS AND REPLACE OR REPAIR RUSTY SHELVING SO IT IS SMOOTH AND SANITARY AND COVER ALL OPEN FOOD PRODUCTS. | 18. NO EVIDENCE OF RODENT OR INSECT OUTER OPENINGS PROTECTED/RODENT PROOFED, A WRITTEN LOG SHALL BE MAINTAINED AVAILABLE TO THE INSPECTORS - Comments: OVER 30 MOUSE DROPPINGS WERE FOUND AT THE TOP OF THE BASEMENT STAIRS ON THE LANDING AND THROUGHOUT THE REAR FOOD STORAGE AREA, REMOVE ALL EVIDENCE OF PEST ACTIVITY AND REPAIR THE SIDE SCREEN DOOR SO IT NO LONGER HAS A 1/4"" GAP IN THE SCREEN. | 21. * CERTIFIED FOOD MANAGER ON SITE WHEN POTENTIALLY HAZARDOUS FOODS ARE  PREPARED AND SERVED - Comments: NO CERTIFIED MANAGER UPON ENTRY WHILE MEAT WAS BEING COOKED AND SERVED.  MR. ALFREDO ROJAS CAME IN 45 MINUTES INTO THE INSPECTION.  A CERTIFIED MANAGER MUST BE PRESENT AT ALL TIMES OF FOOD PREPARATION AND SERVICE. | 32. FOOD AND NON-FOOD CONTACT SURFACES PROPERLY DESIGNED, CONSTRUCTED AND MAINTAINED - Comments: THE STORAGE AND SHELVING THROUGHOUT THE PREMISES IS DIRTY, CLEAN ALL IN DETAIL. | 33. FOOD AND NON-FOOD CONTACT EQUIPMENT UTENSILS CLEAN, FREE OF ABRASIVE DETERGENTS - Comments: THE GASKETS ARE TORN ON THE FRONT COOLER AND ICE IS BUILDING UP IN THE REAR 2-DOOR COOLER, REPAIR AND CLEAN THE ABOVE ITEMS. | 34. FLOORS: CONSTRUCTED PER CODE, CLEANED, GOOD REPAIR, COVING INSTALLED, DUST-LESS CLEANING METHODS USED - Comments: THE FLOORS ARE DIRTY, CLEAN EVERY FLOOR FROM CORNER TO CORNER. | 38. VENTILATION: ROOMS AND EQUIPMENT VENTED AS REQUIRED: PLUMBING: INSTALLED AND MAINTAINED - Comments: THE 4 BURNER STOVE AND PROPANE BURNER ARE NOT UNDER VENTILATION.  DISASSEMBLE THE PROPANE STOVE AND MOVE THE 4 BURNER STOVE UNDER THE VENTILATION HOOD. | 38. VENTILATION: ROOMS AND EQUIPMENT VENTED AS REQUIRED: PLUMBING: INSTALLED AND MAINTAINED - Comments: THE EXPOSED HANDSINK HAS RUSTY WATER COMING OUT, REPAIR THE PLUMBING.",41.85399278549998,-87.68554267529505,"(41.85399278549998, -87.68554267529505)"
1084378,MY GIRLFRIENDS KITCHEN,MY GIRLFRIENDS KITCHEN,2231793,Restaurant,Risk 1 (High),4335 W Madison ST,CHICAGO,IL,60624,02/06/2013,License,Fail,"10. SEWAGE AND WASTE WATER DISPOSAL, NO BACK SIPHONAGE, CROSS  CONNECTION AND/OR BACK FLOW - Comments: THE SOUTH COMPARTMENT OF THE THREE COMPARTMENT SINK LEAKS INTO A CONTAINER, REPAIR THE WASTE WATER LEAK.  TWO STOPPERS ARE MISSING FROM THE THREE COMPARTMENT SINK, OBTAIN TWO WORKING STOPPERS. | 19. OUTSIDE GARBAGE WASTE GREASE AND STORAGE AREA; CLEAN, RODENT PROOF, ALL CONTAINERS COVERED - Comments: THE GARBAGE DUMPSTER DOORS HAVE 3""-4"" GAPS WHEN CLOSED, HAVE THE DUMPSTER REPAIRED OR REPLACED. | 33. FOOD AND NON-FOOD CONTACT EQUIPMENT UTENSILS CLEAN, FREE OF ABRASIVE DETERGENTS - Comments: THE GAS FIRED GYRO MACHINE IS NOT UNDER THE VENTILATION HOOD, MOVE THE UNIT UNDER THE HOOD.  THE ICE MACHINE IS DIRTY AND NOT WORKING, REPAIR OR REMOVE THE UNIT.  THE SODA DISPENSER IS DIRTY; WASH, RINSE AND SANITIZE THE ENTIRE UNIT. | 34. FLOORS: CONSTRUCTED PER CODE, CLEANED, GOOD REPAIR, COVING INSTALLED, DUST-LESS CLEANING METHODS USED - Comments: THE FLOORS ARE DIRTY, CLEAN THE FLOORS FROM CORNER TO CORNER. | 35. WALLS, CEILINGS, ATTACHED EQUIPMENT CONSTRUCTED PER CODE: GOOD REPAIR, SURFACES CLEAN AND DUST-LESS CLEANING METHODS - Comments: THE WALLS HAVE FOAM SEALER STICKING OUT OF THE HOLES SEALED, SHAVE THE FOAM AND SEAL THE EXPOSED AREA SO IT IS SMOOTH AND SANITARY.",41.88051271628613,-87.7344379090307,"(41.88051271628613, -87.7344379090307)"
1084453,ELI WHITNEY ELEMENTARY SCHOOL/ANNEX,ELI WHITNEY ELEMENTARY SCHOOL/ANNEX,1981701,School,Risk 1 (High),2845 S KOMENSKY AVE,CHICAGO,IL,60623,03/21/2013,Canvass,Pass w/ Conditions,"25. TOXIC ITEMS PROPERLY STORED, LABELED AND USED - Comments: TWO BOTTLES OF ""ABSOLUTELY FABULOUS"" CLEANING SOLUTION WHICH HAS NO INGREDIENTS LISTED ANYWHERE ON THE BOTTLE WAS FOUND IN MODULAR PRE-K ROOM M-1, A GALLON OF BLEACH AND A COCA COLA BOTTLE WITH A BRIGHT BLUE CLEANING SOLUTION WAS FOUND IN THE BOTTOM OF AN UNLOCKED CABINET BETWEEN M-1 AND M-2 ALONG WITH AN UNMARKED BOTTLE OF LIGHT BLUE CLEANING SOLUTION. A DRINKING WATER BOTTLE MARKED ""FABULOSO"" WAS FOUND IN ROOM M-1 ON A LOW SHELF.  AN UNMARKED SPRAY BOTTLE OF LIGHT BLUE SOLUTION WAS FOUND IN FRONT OF THE CHILDRENS TOILET IN M-2.    ALL OF THE ABOVE ITEMS WERE REMOVED FROM THE ROOMS AT THIS TIME AND SCHOOL EMPLOYEES WERE COUNSELED TO REQUEST ALL CLEANING PRODUCTS FROM A SCHOOL APPROVED SOURCE. DISCUSSED CLEANING SUPPLY USAGE WITH THE SCHOOL PRINCIPAL AND ENGINEER AT THIS TIME AND SUGGESTED A TRAINING PLAN FOR SCHOOL EMPLOYEES AND HELPERS. | 35. WALLS, CEILINGS, ATTACHED EQUIPMENT CONSTRUCTED PER CODE: GOOD REPAIR, SURFACES CLEAN AND DUST-LESS CLEANING METHODS - Comments: THE CEILING ABOVE THE ANNEX REAR KITCHEN PREP TABLE IS WATER DAMAGED, REPLACE THE DAMAGED CEILING TILES.  THE BATHROOM WALLS IN ROOMS M-2, 112, 113 AND 114 ARE DIRTY AND DAMAGED, CLEAN AND RESEAL THE WALLS SO THEY ARE SMOOTH AND SANITARY. | 36. LIGHTING: REQUIRED MINIMUM FOOT-CANDLES OF LIGHT PROVIDED, FIXTURES SHIELDED - Comments: THE SINK / STORAGE AREA BETWEEN ROOMS M-1 AND M-2 IS VERY DARK, INSTALL ADDITIONAL LIGHTING. | 38. VENTILATION: ROOMS AND EQUIPMENT VENTED AS REQUIRED: PLUMBING: INSTALLED AND MAINTAINED - Comments: THE TOILET FLUSH BUTTON IS HANGING OUT OF THE WALL OF THE WASHROOM IN ROOM # 114, A FAUCET HANDLE IS MISSING IN ROOM # 113 SINK AND THE SINK IN ROOM # 114 DRAINS SLOWLY, REPAIR THE PLUMBING.",41.83920450598151,-87.72548327717382,"(41.83920450598151, -87.72548327717382)"
