Inspection ID,DBA Name,AKA Name,License #,Facility Type,Risk,Address,City,State,Zip,Inspection Date,Inspection Type,Results,Violations,Latitude,Longitude,Location
1098285,ST. BENEDICT HIGH SCHOOL,ST BENEDICT HIGH SCHOOL,1878447,School,Risk 1 (High),3900 N LEAVITT ST,CHICAGO,IL,60618,05/02/2012,Canvass,Pass w/ Conditions,"8. SANITIZING RINSE FOR EQUIPMENT AND UTENSILS:  CLEAN, PROPER TEMPERATURE, CONCENTRATION, EXPOSURE TIME - Comments: OBSERVED EMPLOYEES (TWO) WASHING AND RINSING MULTI-USE UTENSILS AND EQUIPMENT THRU-OUT THE KITCHEN, HOWEVER NOT SANITIZING.  WHEN ASKED, CERTIFIED FOOD MANAGER STATED; ""WE DO NOT HAVE ANY SANITIZER, WE JUST WASH AND RINSE.""  INSTRUCTED, ALL MULTI-USE UTENSILS AND EQUIPMENT MUST BE WASHED, RINSED AND SANITIZED WITH 100PPM CHLORINE. MANAGER WENT OUT TO PURCHASED BLEACH.  CRITICAL CITATION ISSUED, 7-38-030. | 32. FOOD AND NON-FOOD CONTACT SURFACES PROPERLY DESIGNED, CONSTRUCTED AND MAINTAINED - Comments: MUST REPLACE CUTTING BOARDS IN KITCHEN AND SEAL/REPAINT STORAGE SHELVES THRU-OUT BOTH DRY STORAGE CLOSETS. | 33. FOOD AND NON-FOOD CONTACT EQUIPMENT UTENSILS CLEAN, FREE OF ABRASIVE DETERGENTS - Comments: THE FOLLOWING NOT CLEAN, MUST CLEAN/SANITIZE; COOKING EQUIPMENT, ALL STORAGE SHELVES IN BOTH STORAGE CLOSETS, BOTTOM PANELS OF PREP TABLES, CABINETS THRU-OUT THE KITCHEN AND MICROWAVE OVENS IN LUNCH ROOM. | 34. FLOORS: CONSTRUCTED PER CODE, CLEANED, GOOD REPAIR, COVING INSTALLED, DUST-LESS CLEANING METHODS USED - Comments: EXCESSIVE DEBRIS THRU-OUT STORAGE ROOMS, MOP CLOSETS AND BOILET ROOM, INSTRUCTED TO CLEAN FLOORS, UNDER, BEHIND EQUIPMENT AT CORNERS AND ALONG WALLS THRU-OUT ABOVE AREAS AND KITCHEN. | 35. WALLS, CEILINGS, ATTACHED EQUIPMENT CONSTRUCTED PER CODE: GOOD REPAIR, SURFACES CLEAN AND DUST-LESS CLEANING METHODS - Comments: INSTRUCTED TO CLEAN WALLS THRU-OUT THE KITCHEN AND CEILING ATTACHMENTS IN LUNCH ROOM. | 38. VENTILATION: ROOMS AND EQUIPMENT VENTED AS REQUIRED: PLUMBING: INSTALLED AND MAINTAINED - Comments: MUST REPAIR/OR REPLACE BROKEN FAUCETS AT FOLLOWING WASHROOMS, 3RD FLOOR GIRLS, 2ND FLOOR BOYS, BOTH WASHROOMS IN THE GYM, AND PIPES UNDER STAFF WASHROOM HAND WASHING BOWL AT 2ND FLOOR.  REPAIR ALL BROKEN FAUCETS WHERE NEEDED. | 41. PREMISES MAINTAINED FREE OF LITTER, UNNECESSARY ARTICLES, CLEANING  EQUIPMENT PROPERLY STORED - Comments: EXCESSIVE CLUTTER THRU-OUT CLOSETS, BOILER ROOM AND REAR OF KITCHEN, INSTRUCTED TO REMOVE UNNECESSARY ARTICLES, CLEAN AND ORGANIZE TO PREVENT PEST HARBORAGE.  ARTICLES MUST BE STORED OFF FLOORS, AWAY FROM WALLS.",41.9523567935493,-87.68370683817736,"(41.9523567935493, -87.68370683817736)"
1098309,STAROPOLSKA RESTAURANT,STAROPOLSKA RESTAURANT,1275762,Restaurant,Risk 1 (High),3028-3030 N MILWAUKEE AVE,CHICAGO,IL,60618,05/10/2012,Canvass,Pass w/ Conditions,"3. POTENTIALLY HAZARDOUS FOOD MEETS TEMPERATURE REQUIREMENT DURING STORAGE, PREPARATION DISPLAY AND SERVICE - Comments: OBSERVED POTENTIALLY HAZARDOUS FOODS AT IMPROPER TEMPERATURES; 4LBS. OF PASTA AT 64.5F, 2DOZ. EGGS AT 68.7F AND ABOUT 5LBS POTATOES AT 66.7, ABOVE FOOD ITEMS ON TOP OF PREP TABLE.  CERTIFIED FOOD MANAGER STATED, ""FOOD WAS COOKED YESTERDAY.  NO TEMPERATURE LOGS.  INSTRUCTED COLD POTENTIALLLY HAZARDOUS FOODS MUST BE AT 40F OR BELOW.  FOODS DISCARDED. V=100.  CRITICAL CITATION ISSUED, 7-38-005(A). | 11. ADEQUATE NUMBER, CONVENIENT, ACCESSIBLE, DESIGNED, AND MAINTAINED - Comments: OBSERVED KITCHEN EXPOSED SINK NOT ACCESSIBLE FOR PROPER HAND WASHING.  FOUND TEN PIECES OF MULTI-USE UTENSILS, PARTS OF POTATOES PEELER INSIDE ABOVE SINK.  INSTRUCTED SINK MUST BE ACCESSIBLE FOR PROPER HAND WASHING AT ALL TIMES.  CRITICAL CITATION ISSUED, 7-38-030. | 30. FOOD IN ORIGINAL CONTAINER, PROPERLY LABELED: CUSTOMER ADVISORY POSTED AS NEEDED - Comments: INSTRUCTED TO LABEL PREP FOODS INSIDE WALK IN COOLER. | 32. FOOD AND NON-FOOD CONTACT SURFACES PROPERLY DESIGNED, CONSTRUCTED AND MAINTAINED - Comments: INSTRUCTED TO PROVIDE SPLASH GUARDS BETWEEN EXPOSED SINK, MOP SINK AND 3PART SINK. | 33. FOOD AND NON-FOOD CONTACT EQUIPMENT UTENSILS CLEAN, FREE OF ABRASIVE DETERGENTS - Comments: THE FOLLOWING IN NEED OF CLEANING;  MUST CLEAN/SANITZE; COOLERS, FREEZERS, COOKING EQUIPMENT, BOTTOM PANELS OF PREP TABLES, AND STORAGE SHELVES.  MUST REMOVE FOIL COVERING FROM EQUIPMENT. | 35. WALLS, CEILINGS, ATTACHED EQUIPMENT CONSTRUCTED PER CODE: GOOD REPAIR, SURFACES CLEAN AND DUST-LESS CLEANING METHODS - Comments: MUST CLEAN FILTER ABOVE COOKING EQUIPMENT. | 38. VENTILATION: ROOMS AND EQUIPMENT VENTED AS REQUIRED: PLUMBING: INSTALLED AND MAINTAINED - Comments: OBSERVED BOTH 3PART SINKS FAUCETS AT PREP AREAS IN POOR REPAIR, MUST REPAIR OR REPLACE. | 41. PREMISES MAINTAINED FREE OF LITTER, UNNECESSARY ARTICLES, CLEANING  EQUIPMENT PROPERLY STORED - Comments: INSTRUCTED TO REMOVE UNNECESSARY ARTICLES THRU-OUT STORAGE AREAS, CLEAN AND ORGANIZE TO PREVENT PEST HARBORAGE.  ARTICLES MUST BE STORED OFF FLOORS, AWAY FROM WALLS.",41.93615962741124,-87.71926217666866,"(41.93615962741124, -87.71926217666866)"
1098314,ORIGINAL ALPS,ORIGINAL ALPS,1990912,Restaurant,Risk 1 (High),3637 W IRVING PARK RD,CHICAGO,IL,60618,03/14/2012,Canvass,Pass w/ Conditions,"3. POTENTIALLY HAZARDOUS FOOD MEETS TEMPERATURE REQUIREMENT DURING STORAGE, PREPARATION DISPLAY AND SERVICE - Comments: POTENTIALLY HAZARDOUS FOOD AT IMPROPER TEMPERATURE; FOUND ONE LARGE CONTAINER WITH ABOUT 10LBS OF POTATOES AT 64.7F, INADEQUATE FOOR PROTECTION.  CERTIFIED FOOD MANAGER STATES; ""POTATOES COOKED YESTERDAY, BUT POTATOES OUT AT ROOM TEMPERATURE TO PREPARE ORDERS.""  INSTRUCTED COLD POTENTIALLY HAZARDOUS FOOD MUST BE AT 40F OR BELOW.  FOOD DISCARDED, V=$60.00.  CRITICAL CITATION ISSUED, 7-38-005(A). | 6. HANDS WASHED AND CLEANED, GOOD HYGIENIC PRACTICES; NO BARE HAND CONTACT WITH READY-TO-EAT FOODS. - Comments: OBSERVED EMPLOYEE WASHING HIS HANDS INSIDE 3PART SINK.  POOR HYGIENIC PRACTICES.  INSTRUCTED, HAND MUST BE WASHED AT EXPOSED SINK WITH WARM WATER AND SOAP, THE WASHING OF HANDS INSIDE A UTENSILS-WASHING SINK IS PROHIBITED.  CRITICAL CITATION ISSUED, 7-38-010(A). | 30. FOOD IN ORIGINAL CONTAINER, PROPERLY LABELED: CUSTOMER ADVISORY POSTED AS NEEDED - Comments: PREP FOODS INSIDE WALK IN COOLER NOT LABELED, MUST LABEL AND MAINTAIN. | 31. CLEAN MULTI-USE UTENSILS AND SINGLE SERVICE ARTICLES PROPERLY STORED: NO REUSE OF SINGLE SERVICE ARTICLES - Comments: CLEAN MULTI-USE UTENSILS MUST BE PROPERLY STORED. | 33. FOOD AND NON-FOOD CONTACT EQUIPMENT UTENSILS CLEAN, FREE OF ABRASIVE DETERGENTS - Comments: THE FOLLOWING NOT CLEAN, MUST CLEAN/SANITIZE; COOLERS, FREEZERS, BOTTOM PANELS OF PREP TABLES, UPPER INTERIOR PANEL OF ICE MACHINE, AND CAN OPENER AND ALL CABINETS AT FRONT PREP AREA. | 34. FLOORS: CONSTRUCTED PER CODE, CLEANED, GOOD REPAIR, COVING INSTALLED, DUST-LESS CLEANING METHODS USED - Comments: MUST CLEAN FLOORS; UNDER COOKING EQUIPMENT, DISH MACHINE AND THRU-OUT REAR STORAGE AREA, AND BASEMENT. | 35. WALLS, CEILINGS, ATTACHED EQUIPMENT CONSTRUCTED PER CODE: GOOD REPAIR, SURFACES CLEAN AND DUST-LESS CLEANING METHODS - Comments: MUST CLEAN LIGHT SHIELDS THRU-OUT KITCHEN. | 40. REFRIGERATION AND METAL STEM THERMOMETERS PROVIDED AND CONSPICUOUS - Comments: MUST PROVIDE THERMOMETERS FOR COOLERS. | 41. PREMISES MAINTAINED FREE OF LITTER, UNNECESSARY ARTICLES, CLEANING  EQUIPMENT PROPERLY STORED - Comments: EXCESSIVE CLUTTER THRU-OUT BASEMENT; INSTRUCTED TO REMOVE UNNECESSARY ARTICLES, CLEAN AND ORGANIZE TO PREVENT PEST HARBORAGE; ARTICLES MUST BE STORED OFF FLOORS, AWAY FROM WALLS. | 43. FOOD (ICE) DISPENSING UTENSILS, WASH CLOTHS PROPERLY STORED - Comments: ICE SCOOPS AND CLEANING TOWELS MUST BE PROPERLY STORED.",41.95362464225412,-87.71931084947838,"(41.95362464225412, -87.71931084947838)"
1098346,RIVIERA MAYA,RIVIERA MAYA,2157276,Restaurant,Risk 1 (High),4009 N ELSTON AVE,CHICAGO,IL,60618,05/30/2012,License,Fail,"9. WATER SOURCE: SAFE, HOT & COLD UNDER CITY PRESSURE - Comments: NO HOT WATER, INSTRUCTED TO PROVIDE HOT RUNNING WATER UNDER CITY PRESSURE. | 11. ADEQUATE NUMBER, CONVENIENT, ACCESSIBLE, DESIGNED, AND MAINTAINED - Comments: MUST PROPERLY INSTALL AN EXPOSED HAND WASHING SINK AT MAIN KITCHEN WITH HOT/COLD WATER. | 12. HAND WASHING FACILITIES: WITH SOAP AND SANITARY HAND DRYING DEVICES, CONVENIENT AND ACCESSIBLE TO FOOD PREP AREA - Comments: MUST PROVIDE SOAP AND SANITARY HAND DRYING DEVICES FOR ALL HAND WASHING SINKS. | 18. NO EVIDENCE OF RODENT OR INSECT OUTER OPENINGS PROTECTED/RODENT PROOFED, A WRITTEN LOG SHALL BE MAINTAINED AVAILABLE TO THE INSPECTORS - Comments: NO PEST CONTROL LOG BOOK, INSTRUCTED TO CONTRACT A LICENSED PEST CONTROL AND PROVIDE LOG BOOK UPON REINSPECTION. | 32. FOOD AND NON-FOOD CONTACT SURFACES PROPERLY DESIGNED, CONSTRUCTED AND MAINTAINED - Comments: MUST REPLACE CUTTING BOARDS, SEAL ALL RAW/BARE WOOD SHELVES, FRAMES, AND PROVIDE ADEQUATE SHELVING UNITS. | 33. FOOD AND NON-FOOD CONTACT EQUIPMENT UTENSILS CLEAN, FREE OF ABRASIVE DETERGENTS - Comments: MUST CLEAN/SANITIZE; COOLERS, FREEZERS, PREP TABLES, COOKING EQUIPMENT, SINKS, SLICER, CARTS, SHELVES, CAN OPENERS, TABLES, ALL EQUIPMENT THRU-OUT PREMISES. | 34. FLOORS: CONSTRUCTED PER CODE, CLEANED, GOOD REPAIR, COVING INSTALLED, DUST-LESS CLEANING METHODS USED - Comments: MUST CLEAN FLOORS, UNDER, BEHIND EQUIPMENT AT CORNERS AND ALONG WALLS, THRU-OUT PREMISES, INCLUDING BASEMENT. | 35. WALLS, CEILINGS, ATTACHED EQUIPMENT CONSTRUCTED PER CODE: GOOD REPAIR, SURFACES CLEAN AND DUST-LESS CLEANING METHODS - Comments: INSTRUCTED TO REPLACE MISSING WALL TILE, REPLACE DAMAGED CEILING PANELS AT REAR PREP/DISH WASHING AREA, AND PROVIDE BASEBOARDS THRU-OUT DINING AREA.  ALSO MUST CLEAN HOOD AND FILTERS ABOVE COOKING EQUIPMETN AT MAIN KITCHEN. | 38. VENTILATION: ROOMS AND EQUIPMENT VENTED AS REQUIRED: PLUMBING: INSTALLED AND MAINTAINED - Comments: MUST PROVIDE A BACK FLOW PREVENTOR FOR THE ICE MACHINE, CLEAN AND SEAL RUSTY GREASE TRAP UNDER 3PART SINK AT DISH WASHING AREA, AND  PROVIDE DRAIN STOPPERS FOR SAME SINK. | 41. PREMISES MAINTAINED FREE OF LITTER, UNNECESSARY ARTICLES, CLEANING  EQUIPMENT PROPERLY STORED - Comments: MUST REMOVE UNNECESSARY ARTICLES THRU-OUT PREMISES, CLEAN AND ORGANIZE TO PREVENT PEST HARBORAGE.  ARTICLES MUST BE STORED OFF FLOORS, AWAY FROM WALLS. | 70. NO SMOKING REGULATIONS - Comments: MUST PROVIDE, ""NO SMOKING"" SIGNS.",41.953996694516604,-87.71937320043452,"(41.953996694516604, -87.71937320043452)"
1098374,CHARLIES  SUPERMARKET INC.,CHARLIE'S,1441898,Grocery Store,Risk 3 (Low),2941 W MONTROSE AVE,CHICAGO,IL,60618,06/13/2012,Canvass,Pass,"30. FOOD IN ORIGINAL CONTAINER, PROPERLY LABELED: CUSTOMER ADVISORY POSTED AS NEEDED - Comments: INSTRUCTED TO LABEL PREP FOODS INSIDE THE WALK IN COOLER. | 32. FOOD AND NON-FOOD CONTACT SURFACES PROPERLY DESIGNED, CONSTRUCTED AND MAINTAINED - Comments: INSTRUCTED TO REPLACE CUTTING BOARDS. | 33. FOOD AND NON-FOOD CONTACT EQUIPMENT UTENSILS CLEAN, FREE OF ABRASIVE DETERGENTS - Comments: THE FOLLOWING NOT CLEANED, MUST CLEAN/SANITIZE; COOLERS, SLICER, GRINDER, BOTTOM PANELS OF PREP/CUTTING TABLES, MICROWAVE OVEN, AND CABINET UNDER HAND BOWL IN WASHROOM; ALSO TO REMOVE FOIL COVERING FROM EQUIPMENT. | 34. FLOORS: CONSTRUCTED PER CODE, CLEANED, GOOD REPAIR, COVING INSTALLED, DUST-LESS CLEANING METHODS USED - Comments: MUST CLEAN FLOORS, UNDER DISPLAY SHELVES AND INSICE UTILITY CLOSETS. | 35. WALLS, CEILINGS, ATTACHED EQUIPMENT CONSTRUCTED PER CODE: GOOD REPAIR, SURFACES CLEAN AND DUST-LESS CLEANING METHODS - Comments: INSTRUCTED TO SEAL OPENINGS ON WALLS AND CEILING AT REAR STORAGE AREA AND KITCHEN TO PREVENT PEST ENTRY. | 36. LIGHTING: REQUIRED MINIMUM FOOT-CANDLES OF LIGHT PROVIDED, FIXTURES SHIELDED - Comments: MUST REPLACE MISSING LIGHT SHIELDS IN PREP AREA. | 38. VENTILATION: ROOMS AND EQUIPMENT VENTED AS REQUIRED: PLUMBING: INSTALLED AND MAINTAINED - Comments: MUST REMOVE THE THREADS OR PROVIDE A BACK FLOW PREVENTOR FOR MOP SINK. | 41. PREMISES MAINTAINED FREE OF LITTER, UNNECESSARY ARTICLES, CLEANING  EQUIPMENT PROPERLY STORED - Comments: NOTED CLUTTER, INSTRUCTED TO REMOVE UNNECESSARY ARTICLES, CLEAN AND ORGANIZE STORAGE AREAS AND UTILITY ROOMS TO PREVENT PEST HARBORAGE.  ARTICLES MUST STORED OFF FLOORS, AWAY FROM WALLS.",41.961114426323554,-87.70258693864628,"(41.961114426323554, -87.70258693864628)"
1098434,CARNICERIA DE GALLO,CARNICERIA DE GALLO,1275025,GROCERY STORE/TAQUERIA,Risk 1 (High),3247-3249 W MONTROSE AVE,CHICAGO,IL,60618,07/11/2012,Canvass,Pass w/ Conditions,"3. POTENTIALLY HAZARDOUS FOOD MEETS TEMPERATURE REQUIREMENT DURING STORAGE, PREPARATION DISPLAY AND SERVICE - Comments: POTENTIALLY HAZARDOUS FOODS AT IMPROPER TEMPERATURES; OBSERVED A CONTAINER WITH ABOUT 8LBS OF COOKED PORK AT 50.9F, ANOTHER CONTAINER WITH 10LBS OF COOKED CHICKED AT 55.5F. BOTH CONTAINERS ON TOP OF PREP TABLE. CERTIFIED FOOD MANAGER STATED, ""MEAT WAS COOKED YESTERDAY."" INSTRUCTED POTENTIALLY HAZARDOUS FOODS MUST BE COLD AT 40F OR BELOW.  MEAT DISCARTED; V=$115.  CRITICAL CITATION ISSUED, 7-38-005(A). | 11. ADEQUATE NUMBER, CONVENIENT, ACCESSIBLE, DESIGNED, AND MAINTAINED - Comments: EXPOSED HAND WASHING SINK IN THE KITCHEN NOT ACCESSIBLE FOR PROPER HAND WASHING. OBSERVED SEVERAL MULTI-USE UTENSILS INSIDE THE SINK; (TWO KNIVES, THREE CUPS AND SIX PLATES IN SIDE THE SINK). INSTRUCTED, SINK MUST BE ACCESSIBLE FOR PROPER HAND WASHING.  CRITICAL CITATION ISSUED, 7-38-030. | 30. FOOD IN ORIGINAL CONTAINER, PROPERLY LABELED: CUSTOMER ADVISORY POSTED AS NEEDED - Comments: PREP FOODS INSIDE WALK IN COOLER AND DRIED FOOD NOT LABEL, INSTRUCTED TO LABEL AND MAINTAIN. | 32. FOOD AND NON-FOOD CONTACT SURFACES PROPERLY DESIGNED, CONSTRUCTED AND MAINTAINED - Comments: MUST REPLACE CUTTING BOARDS AT MEAT/BUTCHER AREA AND KITCHEN, AND REPAINT STORAGE SHELVES AT MEAT/BUTCHER AREA; ALSO REPLACE BROKEN GASKETS ON MILK COOLER DOORS. | 33. FOOD AND NON-FOOD CONTACT EQUIPMENT UTENSILS CLEAN, FREE OF ABRASIVE DETERGENTS - Comments: THE FOLLOWING NOT CLEAN; MUST CLEAN/SANITIZE; COOLERS, FREEZERS, DISPLAY AND STORAGE SHELVES, MICROWAVE OVENS, COOKING EQUIPMENT, SLICER, GRINDER, BOTTOM PANELS OF PREP TABLES, ICE MACHINE, HOT HOLDING UNITS, ALL EQUIPMENT THRU-OUT PREMISES. | 34. FLOORS: CONSTRUCTED PER CODE, CLEANED, GOOD REPAIR, COVING INSTALLED, DUST-LESS CLEANING METHODS USED - Comments: INSTRUCTED TO REPLACE BROKEN AND MISSING FLOOR TILES THRU-OUT AND CLEAN FLOORS, UNDER, BEHIND EQUIPMENT AT CORNERS AND ALONG WALLS THRU-OUT PREMISES. | 35. WALLS, CEILINGS, ATTACHED EQUIPMENT CONSTRUCTED PER CODE: GOOD REPAIR, SURFACES CLEAN AND DUST-LESS CLEANING METHODS - Comments: INSTRUCTED TO REPLACE DAMAGED CEILING PANELS THRU-OUT, CLEAN WALLS IN THE KITCHEN AND WALK IN COOLER, AND REPLACE MISSING WALL TILES IN WASHROOM. | 38. VENTILATION: ROOMS AND EQUIPMENT VENTED AS REQUIRED: PLUMBING: INSTALLED AND MAINTAINED - Comments: INSTRUCTED TO SEAL RUSTY GREASE TRAP UNDER MEAT/BUTCHER AREA 3PART SINK AND REPAIR LEAKING PIPES UNDER 2PART SINK IN KITCHEN. | 40. REFRIGERATION AND METAL STEM THERMOMETERS PROVIDED AND CONSPICUOUS - Comments: MUST PROVIDE THERMOMETERS FOR COOLERS. | 41. PREMISES MAINTAINED FREE OF LITTER, UNNECESSARY ARTICLES, CLEANING  EQUIPMENT PROPERLY STORED - Comments: EXCESSIVE CLUTTER THRU-OUT KITCHEN AND MEAT/BUTCHER AREA; INSTRUCTED TO REMOVE UNNECESSARY ARTICLEA, CLEAN AND ORGANIZE TO PREVENT PEST HARBORAGE.  ARTICLES MUST BE STORED OFF FLOORS, AWAY FROM WALLS. | 42. APPROPRIATE METHOD OF HANDLING OF FOOD (ICE) HAIR RESTRAINTS AND CLEAN APPAREL WORN - Comments: INSTRUCTED FOOD HANDLERS MUST WEAR HAIR RESTRAINTS. | 43. FOOD (ICE) DISPENSING UTENSILS, WASH CLOTHS PROPERLY STORED - Comments: INSTRUCTED; CLEANING TOWELS AND ICE SCOOP MUST BE PROPERLY STORED.",41.961055755780805,-87.71012079801409,"(41.961055755780805, -87.71012079801409)"
1098484,BURGER KING #7288,BURGER KING #7288,1473519,Restaurant,Risk 2 (Medium),2834 W IRVING PARK RD,CHICAGO,IL,60618,07/31/2012,Canvass,Fail,"12. HAND WASHING FACILITIES: WITH SOAP AND SANITARY HAND DRYING DEVICES, CONVENIENT AND ACCESSIBLE TO FOOD PREP AREA - Comments: NO SANITARY HAND DRYING DEVICES/PAPER TOWELS AT THE EXPOSED HAND SINKS AT TIME OF INSPECTION.  EMPLOYEE WENT TO GET PAPER TOWELS FROM ANOTHER BURGER KING.  INSTRUCTED, MUST PROVIDE PAPER TOWELS AT BOTH EXPOSED SINK AT ALL TIMES.  CRITICAL CITATION ISSUED, 7-38-030. | 18. NO EVIDENCE OF RODENT OR INSECT OUTER OPENINGS PROTECTED/RODENT PROOFED, A WRITTEN LOG SHALL BE MAINTAINED AVAILABLE TO THE INSPECTORS - Comments: EVIDENCE OF INSECTS NOTED; OBSERVED OVER 15 FRUIT FLIES ON WALLS AND BEVERAGE MACHINE AT THE DRIVE THRU SERVING STATION.  ANDERSON PEST CONTROL REPORT STATES, ""FLIES BREEDING UNDER POP MACHINE.""  INSTRUCTED TO CLEAN/SANITIZE, EQUIPMENT, DRAINS AND WALLS.  ADVISED TO CALL PEST CONTROL FOR SERVICE.  SERIOUS CITATION ISSUED, 7-38-020. | 33. FOOD AND NON-FOOD CONTACT EQUIPMENT UTENSILS CLEAN, FREE OF ABRASIVE DETERGENTS - Comments: INSTRUCTED TO CLEAN/SANITIZE; UPPER PANEL OF ICE MACHINE, FRYERS, AND ICEE MACHINE. | 34. FLOORS: CONSTRUCTED PER CODE, CLEANED, GOOD REPAIR, COVING INSTALLED, DUST-LESS CLEANING METHODS USED - Comments: MUST CLEAN FLOORS UNDER HEAVY EQUIPMENT AT CORNERS AND ALONG WALLS AT PREP AREAS. | 36. LIGHTING: REQUIRED MINIMUM FOOT-CANDLES OF LIGHT PROVIDED, FIXTURES SHIELDED - Comments: INSTRUCTED TO REPLACE MISSING LIGHT SHIELD ABOVE 3PART SINK. | 38. VENTILATION: ROOMS AND EQUIPMENT VENTED AS REQUIRED: PLUMBING: INSTALLED AND MAINTAINED - Comments: INSTRUCTED TO REPAIR 3PART AND 2PART SINKS FAUCETS AND PIPES UNDER 2PART SINK. | 40. REFRIGERATION AND METAL STEM THERMOMETERS PROVIDED AND CONSPICUOUS - Comments: INSTRUCTED TO PROVIDE THERMOMETERS FOR COOLERS.",41.95407627735041,-87.69968215567239,"(41.95407627735041, -87.69968215567239)"
1098491,TURQUOISE CAFE,TURQUOISE CAFE,1869346,Restaurant,Risk 1 (High),2147 W ROSCOE ST,CHICAGO,IL,60618,08/02/2012,Canvass,Pass w/ Conditions,"3. POTENTIALLY HAZARDOUS FOOD MEETS TEMPERATURE REQUIREMENT DURING STORAGE, PREPARATION DISPLAY AND SERVICE - Comments: POTENTIALLY HAZARDOUS FOOD AT IMPROPER TEMPERATURE; FOUND LARGE CONTAINER OF CHICKEN NOODLE SOUP, ABOUT 10LBS, INSIDE THE WALK IN COOLER AT 50.1F.  CERTIFIED FOOD MANAGER STATED, ""SOUP COOKED YESTERDAY.""  INSTRUCTED COLD POTENTIALLY HAZARDOUS FOODS MUST BE AT 40F OR BELOW. INADEQUATE FOOD PROTECTION.  SOUP DISCARDED, V=$200. CRITICAL CITATION ISSUED, 7-38-005(A). | 31. CLEAN MULTI-USE UTENSILS AND SINGLE SERVICE ARTICLES PROPERLY STORED: NO REUSE OF SINGLE SERVICE ARTICLES - Comments: INSTRUCTED CLEAN MULTI-USE UTENSILS MUST BE PROPERLY STORED ON STORAGE SHELVES IN THE BASEMENT. | 32. FOOD AND NON-FOOD CONTACT SURFACES PROPERLY DESIGNED, CONSTRUCTED AND MAINTAINED - Comments: INSTRUCTED TO REPLACE BROKEN GASKETS ON PREP REACH IN COOLER DOORS AT MAIN KITCHEN, REPLACE BROKEN WALK IN COOLER DOOR HANDLE. | 33. FOOD AND NON-FOOD CONTACT EQUIPMENT UTENSILS CLEAN, FREE OF ABRASIVE DETERGENTS - Comments: MUST CLEAN/SANITIZE; FREEZER, LARGE OVEN AND STOVE IN BASEMENT KITCHEN. | 34. FLOORS: CONSTRUCTED PER CODE, CLEANED, GOOD REPAIR, COVING INSTALLED, DUST-LESS CLEANING METHODS USED - Comments: MUST CLEAN FLOORS, UNDER, BEHIND EQUIPMENT AT CORNERS AND ALONG WALLS, THRU-OUT BASEMENT KITCHEN AND STORAGE ROOMS. | 35. WALLS, CEILINGS, ATTACHED EQUIPMENT CONSTRUCTED PER CODE: GOOD REPAIR, SURFACES CLEAN AND DUST-LESS CLEANING METHODS - Comments: INSTRUCTED TO CLEAN AND REPAIT WALLS AND CEILING THRU-OUT PREP AREA IN BASEMENT. | 38. VENTILATION: ROOMS AND EQUIPMENT VENTED AS REQUIRED: PLUMBING: INSTALLED AND MAINTAINED - Comments: INSTRUCTED TO REPAIR FAUCETS FOR EXPOSED SINK AT MAIN KITCHEN AT 1ST FLOOR, 3PART SINK IN BASEMENT AND BAR 3PART SINK.  ALSO MUST PROVIDE ADEQUATE VENTILATION FOR LARGE OVEN IN BASEMENT PREP AREA. | 43. FOOD (ICE) DISPENSING UTENSILS, WASH CLOTHS PROPERLY STORED - Comments: INSTRUCTED, CLEANING TOWELS MUST BE PROPERLY STORED.",41.94305483117927,-87.68273539578196,"(41.94305483117927, -87.68273539578196)"
1098703,EL VELERO DE NAYARIT,EL VELERO DE NAYARIT,2189442,Restaurant,Risk 1 (High),3300 W MONTROSE AVE,CHICAGO,IL,60618,11/13/2012,License Re-Inspection,Fail,"18. NO EVIDENCE OF RODENT OR INSECT OUTER OPENINGS PROTECTED/RODENT PROOFED, A WRITTEN LOG SHALL BE MAINTAINED AVAILABLE TO THE INSPECTORS - Comments: NOTED MORE LIVE COCKROACHES IN THE KITCHEN, MUST CLEAN/SANITIZE EQUIPMENT AND CALL PEST CONTROL FOR SERVICE, PEST CONTROL ON PREMISES TODAY HIS REPORT STATES, ""FOUND 5 ROACHES AROUND AREA OUTSIDE THE KITCHEN."" | 33. FOOD AND NON-FOOD CONTACT EQUIPMENT UTENSILS CLEAN, FREE OF ABRASIVE DETERGENTS - Comments: INSTRUCTED TO CLEAN/SANITIZE EQUIPMENT THRU-OUT PREMISES. | 35. WALLS, CEILINGS, ATTACHED EQUIPMENT CONSTRUCTED PER CODE: GOOD REPAIR, SURFACES CLEAN AND DUST-LESS CLEANING METHODS - Comments: MUST SEAL ALL OPENINGS ON WALLS TO PREVENT PEST HARBORAGE.",41.961268212903974,-87.71075304347927,"(41.961268212903974, -87.71075304347927)"
1098707,WEST RIVER CAFE,WEST RIVER CAFE,1646219,Restaurant,Risk 1 (High),4400 N KEDZIE AVE,CHICAGO,IL,60625,11/14/2012,Canvass Re-Inspection,Pass w/ Conditions,"14. PREVIOUS SERIOUS VIOLATION CORRECTED, 7-42-090 - Comments: PREVIOUS SERIOUS VIOLATION NOT CORRECTED FROM REPORT #1188399, DATE 11-7-12, VIOLATION #29.  THE FOLLOWING VIOLATIONS UNDER #29 CORRECTED; #30, PREP FOODS LABELED, #41, UNNECESSARY ARTICLES INSIDE THE BASEMENT REMOVED, AREA CLEANED AND ORGANIZED.  THE FOLLOWING NOT CORRECTED, #32, MUST SEAL RUSTY BOTTOM PANELS OF PREP REACH IN COOLER AND PREP TABLES; HELD FOR INSPECTION TAG PLACED ON UNITS.  #34, MUST REPAIR FLOORS THRU-OUT KITCHEN AND DISH WASHING AREAS. REPAIR PERSON IS WORKING ON REPAIRING THE FLOORS AT THIS TIME, (HE STATED, ""THE FLOORS WILL BE COMPLETED BY 11-21-12, SELF EMPLOYEED."") #36, MUST REPLACE MISSING AND BROKEN LIGHT SHIELDS THRU-OUT THE KITCHEN; AT THIS TIME OWNER REMOVED LIGHT BULBS FROM LIGHT FIXTURES, NO NEED FOR LIGHT SHIELDS.  INSTRUCTED OWNER WHEN REPAIRS ARE COMPLETED TO FAX LETTER OR EMAIL REQUESTING REINSPECTION.  CRITICAL CITATION ISSUED, 7-42-090. | 32. FOOD AND NON-FOOD CONTACT SURFACES PROPERLY DESIGNED, CONSTRUCTED AND MAINTAINED - Comments: NO DRAIN STOPPER ON THE 3 COMPARTMENT SINK. MUST PROVIDE.   | 35. WALLS, CEILINGS, ATTACHED EQUIPMENT CONSTRUCTED PER CODE: GOOD REPAIR, SURFACES CLEAN AND DUST-LESS CLEANING METHODS - Comments: MUST CLEAN IN DETAIL THE VENT COVER INSIDE THE CUSTOMER WASHROOM(WITH HEAVY DUST ACCUMULATED); MUST SCRAPE PEELING PAINT ON THE WALLS INSIDE THE EMPLOYEES WASHROOM; MUST REPLACE STAINED CEILING TILES THRU-OUT DINING AREAS AND MAINTAIN.   | 37. TOILET ROOM DOORS SELF CLOSING: DRESSING ROOMS WITH LOCKERS PROVIDED: COMPLETE SEPARATION FROM LIVING/SLEEPING QUARTERS - Comments: MUST RE ADJUST THE SELF CLOSING DEVICE ON THE DOOR OF CUSTOMER AND EMPLOYEES WASHROOM(NOT CLOSING ALL THE WAY).   | 38. VENTILATION: ROOMS AND EQUIPMENT VENTED AS REQUIRED: PLUMBING: INSTALLED AND MAINTAINED - Comments: MUST REPAIR EXPOSED HAND SINK.(SLOW DRANING AND WATER KEEPS ON CONTINOUSLY DRIPPNG WHEN YOU TURN IT OFF). MUST STOP THE LEAK ON BOTH FAUCETS OF THE 3 COMPARTMENT SINK AND MAINTAIN.   | 40. REFRIGERATION AND METAL STEM THERMOMETERS PROVIDED AND CONSPICUOUS - Comments: MUST PROVIDE VISIBLE THERMOMETER INISDE THE REACH IN FREEZER AND PREP COOLER.",41.961225358561954,-87.70839694891846,"(41.961225358561954, -87.70839694891846)"
1098817,JIMMY'S PIZZERIA AND CAFE,JIMMY'S PIZZERIA AND CAFE,2094445,Restaurant,Risk 1 (High),5159 N LINCOLN AVE,CHICAGO,IL,60625,01/30/2013,Canvass,Pass w/ Conditions,"3. POTENTIALLY HAZARDOUS FOOD MEETS TEMPERATURE REQUIREMENT DURING STORAGE, PREPARATION DISPLAY AND SERVICE - Comments: POTENTIALLY HAZARDOUS FOODS AT IMPROPER TEMPERATURES; FOUND FIVE 20"" PIZZAS(PEPPERONI, CHEESE, SAUSAGE), TEMPERATURES RANGING FROM 55.7F-73.9F, ON TOP OF A PREP TABLES AT FRONT SERVING AREA, AND ABOUT 5LBS OF CHEESE SAUCE AT 55.4. NO TEMPERATURE LOGS AVAILABLE. INADEQUATE FOOD PROTECTION.  INSTRUCTED HOT POTENTIALLY HAZARDOUS FOODS MUST BE AT 140F OR HIGHER OR 40F OR BELOW.  PIZZAS DISCARDED, =$160.  CRITICAL CITATION ISSUED, 7-38-005(A). | 21. * CERTIFIED FOOD MANAGER ON SITE WHEN POTENTIALLY HAZARDOUS FOODS ARE  PREPARED AND SERVED - Comments: NO CERTIFIED FOOD MANAGER ON SITE WHEN POTENTIALLY HAZARDOUS FOODS ARE PREPARED AND SERVED, (PREPARING AND SERVING PIZZAS AT TIME OF INSPECTION.)  INSTRUCTED A CERTIFIED FOOD MANAGER MUST BE ON DUTY AT ALL TIMES WITH CITY CERTIFICATE.  SERIOUS CITATION ISSUED, 7-38-012. | 30. FOOD IN ORIGINAL CONTAINER, PROPERLY LABELED: CUSTOMER ADVISORY POSTED AS NEEDED - Comments: PREP FOODS INSIDE WALK IN COOLER NOT LABELED, INSTRUCTED TO DATE/LABEL AND MAINTAIN. | 33. FOOD AND NON-FOOD CONTACT EQUIPMENT UTENSILS CLEAN, FREE OF ABRASIVE DETERGENTS - Comments: EXCESSIVE FOOD DEBRIS ON EQUIPMENT; INSTRUCTED TO CLEAN/SANITIZE; COOLERS, BOTTOM PANEL OF PREP TABLES, FRYER, DRIED FOOD STORAGE CONTAINERS, STORAGE SHELVES AND MOP SINK. | 34. FLOORS: CONSTRUCTED PER CODE, CLEANED, GOOD REPAIR, COVING INSTALLED, DUST-LESS CLEANING METHODS USED - Comments: DEBRIS/FOOD DEBRIS ON FLOORS, INSTRUCTED TO DETAIL CLEAN FLOORS, UNDER, BEHIND EQUIPMENT AT CORNERS AND ALONG WALLS THRU-OUT PREP AREA, SERVING AREA AND BASEMENT. | 42. APPROPRIATE METHOD OF HANDLING OF FOOD (ICE) HAIR RESTRAINTS AND CLEAN APPAREL WORN - Comments: INSTRUCTED FOOD HANDLERS MUST WEAR HAIR RESTRAINTS. | 43. FOOD (ICE) DISPENSING UTENSILS, WASH CLOTHS PROPERLY STORED - Comments: INSTRUCTED TO PROPERLY STORED CLEANING TOWELS IN AN APPROVED SANITIZER.",41.975763460476685,-87.69219986272583,"(41.975763460476685, -87.69219986272583)"
