Inspection ID,DBA Name,AKA Name,License #,Facility Type,Risk,Address,City,State,Zip,Inspection Date,Inspection Type,Results,Violations,Latitude,Longitude,Location
1106283,DEVON PANTRY,DEVON PANTRY,61683,Grocery Store,Risk 3 (Low),3044 W DEVON AVE,CHICAGO,IL,60659,07/30/2012,Canvass,Fail,"18. NO EVIDENCE OF RODENT OR INSECT OUTER OPENINGS PROTECTED/RODENT PROOFED, A WRITTEN LOG SHALL BE MAINTAINED AVAILABLE TO THE INSPECTORS - Comments: OUTER OPENINGS NOT PROTECTED.OBSERVED  FRONT AND REAR EXIT DOOR NOT RODENT/ INSECTS PROOFED.WE THE MANAGER AND I OBSERVED BOTH DOORS WITH GAPS OF ONE TO TWO INCHES AT BOTTOM DOORS.INSTRUCTED TO RODENT/INSECT PROOF DOORS. SERIOUS VIOLATION:7-38-020  | 32. FOOD AND NON-FOOD CONTACT SURFACES PROPERLY DESIGNED, CONSTRUCTED AND MAINTAINED - Comments: REPAIR TWO COMPARTMENT SINK,SEAL MIDDLE DIVIDER. NO OPEND FOOD AT PRESENT TIME. | 32. FOOD AND NON-FOOD CONTACT SURFACES PROPERLY DESIGNED, CONSTRUCTED AND MAINTAINED - Comments: OBSERVED  NACHOS MACHINE UNPLUGGED,MANAGER STATED NOT IN USE. INSTRUCTED TO REMOVE FROM PREMISES. | 33. FOOD AND NON-FOOD CONTACT EQUIPMENT UTENSILS CLEAN, FREE OF ABRASIVE DETERGENTS - Comments: CLEAN INSIDE COOLERS, DEBRIS, SPECIALLY MILK COOLER. REMOVE EXCESS ICE BUILD-UP FROM ICE CREAM CHEST FREEZERS. | 34. FLOORS: CONSTRUCTED PER CODE, CLEANED, GOOD REPAIR, COVING INSTALLED, DUST-LESS CLEANING METHODS USED - Comments: SWEEP FLOOR INSIDE THE LIQUOR STORAGE AREA, AND REAR AREA. ELEVATE ITEMS 6"" OFF THE FLOOR FROM BOTH SAID PLACES. | 38. VENTILATION: ROOMS AND EQUIPMENT VENTED AS REQUIRED: PLUMBING: INSTALLED AND MAINTAINED - Comments: REPLACE MISSING VENT COVER IN SELLING AREA BY THE LIQUOR STORAGE AREA. ALSO NEED TO CLEAN OTHER VENT COVER DUST BUILD-UP",41.99755215122281,-87.70629807935669,"(41.99755215122281, -87.70629807935669)"
1106285,7 ELEVEN #33809J,7 ELEVEN,2094351,Grocery Store,Risk 2 (Medium),6801 N Sheridan RD,CHICAGO,IL,60626,08/01/2012,Complaint,Fail,"11. ADEQUATE NUMBER, CONVENIENT, ACCESSIBLE, DESIGNED, AND MAINTAINED - Comments: EXPOSED HAND SINK IN PREP AREA NOT MAINTAINED, NO HOT RUNNING WATER PROVIDE AT SAID SINK. FOUND HOT WATER HANDLE BROKEN. HOT WATER VALVE  WAS TURNED OFF FROM UNDER THE SINK DUE TO HOT WATER CONTINUOUSLY RUNNING.WHEN HOT WATER WAS TURNED ON WATER WAS BROWN IN COLOR WHICH TOOK SEVERAL MINUTES TO CLEAR IT.EXPOSED HAND SINK TAGGED ""HELD FOR INSPECTION"". CEASE AND DESIST FOOD OPERATION UNTIL EXPOSED HAND SINK IS REPAIRED. INSTRUCTED TO ONLY SELL PREPACKAGED FOOD.  CRITICAL VIOLATION: 7-38-030 | 12. HAND WASHING FACILITIES: WITH SOAP AND SANITARY HAND DRYING DEVICES, CONVENIENT AND ACCESSIBLE TO FOOD PREP AREA - Comments: NO PAPER TOWELS PROVIDED AT EXPOSED HAND SINK IN PREP AREA, ALSO NO PAPER TOWELS PROVIDED AT REAR STAFF WASHROOM. PAPER TOWELS WERE PROVIDED AT SAID SINKS AFTER MY REQUEST. INFORMATION GIVEN ON HAND WASHING. CRITICAL VIOLATION: 7-38-030.   | 29. PREVIOUS MINOR VIOLATION(S) CORRECTED 7-42-090 - Comments: PREVIOUS MINOR VIOLATIONS NOT CORRECTED FROM 2-28-2012, REPORT# 670880:   #33-DETAIL CLEAN INSIDE THE 3 COMPARTMENT SINK, EXPOSED HAND SINK FRONT PREP AREA, ALL HAVE DEBRIS ON IT, SPECIALLY MOP SINK REMOVE ALL DIRTY CONTAINERS, DIRTY MOP ETC. CLEAN DEBRIS ON WINDOW LEDGES. NEED TO CLEAN AND MAINTAIN TOILET BOWL IN STAFF WASHROOM.  #34-REPLACE MISSING FLOOR TILE UNDER THE 3 COMPARTMENT SINK AROUND THE WATER PIPE BEHIND THE GREASE TRAP, ALSO CLEAN SAID AREA. NEED TO CLEAN BEHIND THE DONUT SHELF(DEBRIS AND BUILD-UP DUST). CLEAN CORNERS AND ALONG THE WALLS THROUGHOUT THE PREMISES.  #35-REPLACE MISSING FLOOR TILE UNDER THE 3 COMPARTMENT SINK AROUND THE WATER PIPE BEHIND THE GREASE TRAP, ALSO CLEAN SAID AREA. NEED TO CLEAN BEHIND THE DONUT SHELF(DEBRIS AND BUILD-UP DUST). CLEAN CORNERS AND ALONG THE WALLS THROUGHOUT THE PREMISES.  SERIOUS VIOLATION: 7-42-090. | 33. FOOD AND NON-FOOD CONTACT EQUIPMENT UTENSILS CLEAN, FREE OF ABRASIVE DETERGENTS - Comments: VIOLATION UPGRADED TO SERIOUS VIOLATION #29. | 35. WALLS, CEILINGS, ATTACHED EQUIPMENT CONSTRUCTED PER CODE: GOOD REPAIR, SURFACES CLEAN AND DUST-LESS CLEANING METHODS - Comments: VIOLATION WAS UPGRADED TO SERIOUS VIOLATION# 29",42.00561787658474,-87.66078593720823,"(42.00561787658474, -87.66078593720823)"
1106297,EYES ON THE FUTURE,EYES ON THE FUTURE,1595791,Children's Services Facility,Risk 1 (High),6969 N RAVENSWOOD AVE,CHICAGO,IL,60626,08/22/2012,License,Fail,"29. PREVIOUS MINOR VIOLATION(S) CORRECTED 7-42-090 - Comments: VIOLATION FROM PREVIOUS MINOR VIOLATION(# 38 AND #40) NOT CORRECTED FROM 5-6-2011,REPORT 580792, CITATION WAS ISSUED UNDER LICENSE #1493907, REPORT #1106296 | 34. FLOORS: CONSTRUCTED PER CODE, CLEANED, GOOD REPAIR, COVING INSTALLED, DUST-LESS CLEANING METHODS USED - Comments: NEED TO CLEAN FLOOR UNDER THE SHELF INSIDE THE MOP SINK,REAR AREA.NEED TO ELEVATE SHELF 6"" OFF THE FLOOR FOR BETTER HOUSEKEEPING,REMOVE DEBRIS. | 38. VENTILATION: ROOMS AND EQUIPMENT VENTED AS REQUIRED: PLUMBING: INSTALLED AND MAINTAINED - Comments: FAUCET AT THREE COMPARTMENT SINKS IS LEAKING, INSTRUCTED TO REPAIR.",42.00855801348172,-87.67518202595814,"(42.00855801348172, -87.67518202595814)"
1106301,"CHILDREN'S ACADEMY OF NORTH SHORE, LTD.",CHILDREN'S ACADEMY OF NORTH SHORE,23448,Daycare (2 - 6 Years),Risk 1 (High),6711 N SHERIDAN RD,CHICAGO,IL,60626,08/24/2012,License,Pass,"32. FOOD AND NON-FOOD CONTACT SURFACES PROPERLY DESIGNED, CONSTRUCTED AND MAINTAINED - Comments: OBSERVED WINDOW OPENED ABOVE THE TWO COMPARTMENT SINKS,INSTRUCTED TO PROVIDE SCREEN. ALSO REPLACE BROKEN SCREEN AT WINDOW AT OFFICE REAR AREA AT SOUTH BUILDING. | 34. FLOORS: CONSTRUCTED PER CODE, CLEANED, GOOD REPAIR, COVING INSTALLED, DUST-LESS CLEANING METHODS USED - Comments: ELEVATE DIAPERS 6"" FROM FLOOR INSIDE THE STORAGE CLOSET,AT EAST PLAY ROOM,CLEAN DEBRIS ON SAID CLOSET. | 35. WALLS, CEILINGS, ATTACHED EQUIPMENT CONSTRUCTED PER CODE: GOOD REPAIR, SURFACES CLEAN AND DUST-LESS CLEANING METHODS - Comments: PAINT WALL UNDER THE TWO COMPARTMENT SINK, IN KITCHEN. SEAL  HOLE AROUND WATER PIPE UNDER THE CABINET OF WASH BOWL IN PLAY ROOM.  | 35. WALLS, CEILINGS, ATTACHED EQUIPMENT CONSTRUCTED PER CODE: GOOD REPAIR, SURFACES CLEAN AND DUST-LESS CLEANING METHODS - Comments: REMOVE  SPIDER WEB BY THE EAST WINDOW BETWEEN WALL AND BOOKCASE, NORTH BUILDING.",42.00389026241472,-87.66068095631208,"(42.00389026241472, -87.66068095631208)"
1106310,HERNANDEZ ENTERPRISES INC,PANADERIA  EVITA,29345,Bakery,Risk 1 (High),6975 N CLARK ST,CHICAGO,IL,60626,08/29/2012,Canvass,Fail,"3. POTENTIALLY HAZARDOUS FOOD MEETS TEMPERATURE REQUIREMENT DURING STORAGE, PREPARATION DISPLAY AND SERVICE - Comments: FOUND POTENTIALLY HAZARDOUS FOOD AT IMPROPER TEMPERATURE: FLAN CAKE AT TEMP OF 66.0F AND FLAN  CHOCOLATE CAKE AT TEMP OF 64.6F; BOTH PRODUCTS WERE STORED INSIDE THE FRONT COCA-COLA REFRIGERATOR IN SELLING AREA(FEW PIECES OF FLAN CAKE WAS MISSING/SOLD), WHICH AIR TEMP WAS 37.1F; NO TEMPERATURE HOLDING OR COOLING METHOD BEING APPLIED,ALSO NO TIME /TEMPERATURE LOGS AVAILABLE AT THIS TIME. FOOD DISCARDED AND DENATURED. POUND 4 VALUE 34.50.CRITICAL VIOLATION:7-38-005(A) | 18. NO EVIDENCE OF RODENT OR INSECT OUTER OPENINGS PROTECTED/RODENT PROOFED, A WRITTEN LOG SHALL BE MAINTAINED AVAILABLE TO THE INSPECTORS - Comments: OUTER OPENINGS NOT RODENT/INSECT PROOF.OBSERVED MAIN REAR DOOR WIDE OPENED,SCREEN DOOR HAS MESH BROKEN AND SCREEN IS NOT TIGHT FITTED TO FRAME DOOR, GAPS OF 1/2"" TO 2""BOTTOM SIDE AND TOP OF SCREEN DOOR. OBSERVED COUPLE HOUSE FLIES ON PREMISES.INSTRUCTED TO REPAIR SCREEN AND SCREEN DOOR MUST BE TIGHT FITTED TO FRAME DOOR. NO PEST CONTROL LOG BOOK PROVIDED AT PRESENT TIME,ONLY ONE HAND WRITTEN SHEET WAS PROVIDED WITH SERVICE OF 6-4-12.NO OTHER INVOICE PROVIDED. INSTRUCTED TO PROVIDE A PEST CONTROL LOG BOOK. SERIOUS VIOLATION:7-38-020. | 33. FOOD AND NON-FOOD CONTACT EQUIPMENT UTENSILS CLEAN, FREE OF ABRASIVE DETERGENTS - Comments: REMOVE SPIDER WEBS FROM UNDER THE PREP TABLES. CLEAN  EXTERIOR SIDE OF OVEN,EXCESS FLOUR. | 33. FOOD AND NON-FOOD CONTACT EQUIPMENT UTENSILS CLEAN, FREE OF ABRASIVE DETERGENTS - Comments: REMOVE EXCESS ICE BUILD-UP INSIDE THE CHEST FREEZER ,UNABLE TO COMLETELY CLOSE LID IN BASEMENT AREA. | 35. WALLS, CEILINGS, ATTACHED EQUIPMENT CONSTRUCTED PER CODE: GOOD REPAIR, SURFACES CLEAN AND DUST-LESS CLEANING METHODS - Comments: CLEAN OR REPLACE CEILING TILES ABOVE THE TWO OVENS, CEILING TILE ARE BROWN IN COLOR DUE TO SMOKE AND HAVE EXCESS GREASE,DUST BUILD-UP WHICH IS DANGLING FROM TILES AND VENT COVERS. | 36. LIGHTING: REQUIRED MINIMUM FOOT-CANDLES OF LIGHT PROVIDED, FIXTURES SHIELDED - Comments: PROVIDE END CAPS FOR THE LIGHT SHIELD ABOVE THE WOOD PREP TABLE | 38. VENTILATION: ROOMS AND EQUIPMENT VENTED AS REQUIRED: PLUMBING: INSTALLED AND MAINTAINED - Comments: WASHBOWL IN STAFF/CUSTOMERS IS SLOWLY DRAINING,INSTRUCTED TO REPAIR. WASH ROOM AT NORTH-WEST SIDE OF PREMISES.",42.00877825384109,-87.673763668346,"(42.00877825384109, -87.673763668346)"
1106315,CAMP AL GELANY GROCERY,CAMP AL GELANY GROCERY,2026954,Grocery Store,Risk 2 (Medium),2800 W DEVON AVE,CHICAGO,IL,60659,08/30/2012,Canvass Re-Inspection,Pass w/ Conditions,"2. FACILITIES TO MAINTAIN PROPER TEMPERATURE - Comments: FRONT DISPLAY COOLER REMAINS TAGGED 'HELD FOR INSPECTION'. STILL AT IMPROPER TEMPERATURE OF 48F. | 9. WATER SOURCE: SAFE, HOT & COLD UNDER CITY PRESSURE - Comments: NO HOT RUNNING WATER ON PREMISES AT THIS TIME. HOT WATER TEMPERATURE AT 3 COMPARTMENT SINK 80.4F. WATER HEATER IS TURNED OFF. CRITICAL VIOLATION. 7-38-030. OWNER TURNED WATER HEATER ON DURING INSPECTION. MUST MAINTAIN HOT RUNNING WATER AT 110F OR ABOVE. | 14. PREVIOUS SERIOUS VIOLATION CORRECTED, 7-42-090 - Comments: PREVIOUS SERIOUS VIOLATION FROM 8/21/12 INSPECTION (REPORT #1106295) NOT CORRECTED: #24-FAUCET AT THREE COMPARTMENT SINK HAS A SHORT NECK, NOT ABLE TO REACH ALL THREE COMPARTMENTS. INSTRUCTED TO INSTALL A FAUCET WITH A LONGER NECK THAT REACHES ALL THREE COMPARTMENTS. CRITICAL VIOLATION, 7-42-090. INSTRUCTED TO CEASE AND DESIST USE OF MULTI-USE UTENSILS, SUCH AS BULK FOOD SCOOPS. THREE COMPARTMENT SINK TAGGED 'HELD FOR INSPECTION'. FAX LETTER TO 312-746-4240 TO REQUEST TAG REMOVAL WHEN PROPER FAUCET HAS BEEN INSTALLED. | 24. DISH WASHING FACILITIES: PROPERLY DESIGNED, CONSTRUCTED, MAINTAINED, INSTALLED, LOCATED AND OPERATED - Comments: UPGRADED TO CRITICAL VIOLATION #14. | 30. FOOD IN ORIGINAL CONTAINER, PROPERLY LABELED: CUSTOMER ADVISORY POSTED AS NEEDED - Comments: PROVIDE LABELS FOR ALL REPACKED FOOD PRODUCTS. FOOD NAME, SOURCE, INGREDIENTS ETC. | 32. FOOD AND NON-FOOD CONTACT SURFACES PROPERLY DESIGNED, CONSTRUCTED AND MAINTAINED - Comments: NO PROTECTIVE BARRIER BETWEEN EXPOSED HAND SINK AND THREE COMPARTMENT SINK AND NO BARRIER BETWEEN THREE COMPARTMENT SINK AND UTILITY (MOP) SINK. MUST INSTALL WASHABLE, PROTECTIVE BARRIERS BETWEEN SAID SINKS.      CUSTOMER SELF-SERVICE BULK CONTAINERS MUST HAVE SELF-CLOSING LIDS AND MUST BE KEPT CLOSED WHEN NOT IN USE. | 33. FOOD AND NON-FOOD CONTACT EQUIPMENT UTENSILS CLEAN, FREE OF ABRASIVE DETERGENTS - Comments: CLEAN AND MAINTAIN INTERIOR OF THREE COMPARTMENT SINK. | 34. FLOORS: CONSTRUCTED PER CODE, CLEANED, GOOD REPAIR, COVING INSTALLED, DUST-LESS CLEANING METHODS USED - Comments: CLEAN FLOOR THROUGHOUT THE PREMISES INCLUDING REAR AREAS AND STAIRS THAT GO DOWN TO BASEMENT. ELEVATE STOCK AND ITEMS 6"" OFF THE FLOOR. | 35. WALLS, CEILINGS, ATTACHED EQUIPMENT CONSTRUCTED PER CODE: GOOD REPAIR, SURFACES CLEAN AND DUST-LESS CLEANING METHODS - Comments: REPAIR WALL INSIDE THE CABINET UNDER THE WASH BOWL IN STAFF WASHROOM. | 36. LIGHTING: REQUIRED MINIMUM FOOT-CANDLES OF LIGHT PROVIDED, FIXTURES SHIELDED - Comments: REPLACE BROKEN LIGHT SHIELD IN REAR PREP/REPACKING AREA.   | 41. PREMISES MAINTAINED FREE OF LITTER, UNNECESSARY ARTICLES, CLEANING  EQUIPMENT PROPERLY STORED - Comments: REMOVE UNNECESSARY ARTICLE FROM REAR AREA AND STAIRWELL. ORGANIZE WHAT IS NEEDED AND ELEVATE 6"" OFF THE FLOOR.   | 43. FOOD (ICE) DISPENSING UTENSILS, WASH CLOTHS PROPERLY STORED - Comments: CUSTOMER SELF-SERVICE BULK FOOD SCOOPS IMPROPERLY STORED IN FOOD CONTAINERS. MUST STORE SCOOPS IN A PROTECTIVE SLEEVE OR CONTAINER WHEN NOT IN USE. SCOOPS MUST BE ATTACHED TO DISPLAYS WITH A LENGHT OF EASILY CLEANABLE MATERIAL THAT PREVENTS SCOOPS FROM FALLING TO FLOOR.",41.99766952286052,-87.69970642324591,"(41.99766952286052, -87.69970642324591)"
1106318,Phillip  Rogers Elementary School,Phillip  Rogers Elementary School,25141,School,Risk 1 (High),7345 N Washtenaw,CHICAGO,IL,60645,08/30/2012,Canvass,Fail,"18. NO EVIDENCE OF RODENT OR INSECT OUTER OPENINGS PROTECTED/RODENT PROOFED, A WRITTEN LOG SHALL BE MAINTAINED AVAILABLE TO THE INSPECTORS - Comments: OUTER OPENINGS ARE NOT RODENT/INSECT PROOF. INSTRUCTED TO CERTIFIED FOOD MANAGER TO HAVE ALL OUTSIDE DOOR RODENT/INSECT PROOF. SERIOUS VIOLATION:7-38-020, NO CITATION ISSUED SCHOOL IS NOT OPERATING.  OBSERVED WINDOW OPENED IN DINING AND KITCHEN AREA.IF WINDOWS ARE OPENED A SCREEN MUST BE PROVIDED,WITH A TIGHT FITTING TO FRAME. | 34. FLOORS: CONSTRUCTED PER CODE, CLEANED, GOOD REPAIR, COVING INSTALLED, DUST-LESS CLEANING METHODS USED - Comments: REPLACE MISSING FLOOR TILES IN WOMEN'S WASHROOM AT LAST STALL BY THE WASH BOWL,2ND FLOOR.    REPLACE MISSING FLOOR TILE/CEMENT AT SECOND FLOOR BOY'S WASH ROOM WERE THE STALL WAS REMOVED, BY THE URINAL.  | 35. WALLS, CEILINGS, ATTACHED EQUIPMENT CONSTRUCTED PER CODE: GOOD REPAIR, SURFACES CLEAN AND DUST-LESS CLEANING METHODS - Comments: OBSERVED A GRAY DIRTY TAPE ON TOP THE OPENING OF THE WALL/EDGE OF UNUSED WINDOW IN THE KITCHEN,NORTH-EAST AREA), INSTRUCTED TO REMOVE TAPE AND PROPERLY SEAL WALL, SURFACE MUST BE SMOOTH,CLEANABLE,AND NON-ABSORBENT MATERIAL.   SEAL WALL AROUND PIPE IN THE KITCHEN AT NORTH-EAST WALL.  PROVIDE  MISSING WALL TILES BEHIND THE FIRST STALL BEAM,SOUTH WALL AT SECOND FLOOR GIRL'S WASHROOM. | 36. LIGHTING: REQUIRED MINIMUM FOOT-CANDLES OF LIGHT PROVIDED, FIXTURES SHIELDED - Comments: REMOVE UNKNOWN SUBSTANCE FROM INSIDE THE LIGHT SHIELD AT SOUTH AREA  BY THE STAIR CASE | 38. VENTILATION: ROOMS AND EQUIPMENT VENTED AS REQUIRED: PLUMBING: INSTALLED AND MAINTAINED - Comments: WASH BOWL AT BOY'S WASHROOM BY THE WINDOW SLOWLY DRAINING,SECOND FLOOR SOUTH AREA. | 41. PREMISES MAINTAINED FREE OF LITTER, UNNECESSARY ARTICLES, CLEANING  EQUIPMENT PROPERLY STORED - Comments: MUST REMOVE ALL CONSTRUCTION MATERIAL THROUGHOUT PREMISES: DINING AREA, HALLWAYS, CLASS ROOMS,BASEMENT AND OUTSIDE GARBAGE AREA..REORGANIZE ALL AREAS INCLUDED BASEMENT AREA,ELEVATE ITEMS 6"" OFF THE FLOOR THROUGHOUT THE PREMISES.",42.01526617827283,-87.69714857619496,"(42.01526617827283, -87.69714857619496)"
1106324,GARDEN OF EDEN MEDITERRANEAN RESTAURANT,GARDEN OF EDEN,2114917,Restaurant,Risk 1 (High),7156 N CALIFORNIA AVE,CHICAGO,IL,60645,09/12/2012,Canvass,Pass,"32. FOOD AND NON-FOOD CONTACT SURFACES PROPERLY DESIGNED, CONSTRUCTED AND MAINTAINED - Comments: REMOVE DIRTY AND BROKEN GRAY TAPE FROM THE LID AT DISPLAY PREP COOLER,EAST SIDE. | 32. FOOD AND NON-FOOD CONTACT SURFACES PROPERLY DESIGNED, CONSTRUCTED AND MAINTAINED - Comments: PROPERLY STORE PLASTIC UTENSILS  BEHIND FRONT COUNTER, INVERT THE SPOON-FORKS ETC. | 32. FOOD AND NON-FOOD CONTACT SURFACES PROPERLY DESIGNED, CONSTRUCTED AND MAINTAINED - Comments: PROVIDE A SPLASH GUARD BETWEEN THE EXPOSED HAND SINK AND THREE COMPARTMENT, SURFACE MUST BE SMOOTH, CLEANABLE AND NON-ABSORBENT MATERIAL.  PROVIDE A KNIFE RACK TO BE ABLE TO STORE KNIFE TO MINIMIZE SOURCE OF CONTAMINATION | 38. VENTILATION: ROOMS AND EQUIPMENT VENTED AS REQUIRED: PLUMBING: INSTALLED AND MAINTAINED - Comments: EXPOSED HAND SINK IN PREP AREA SLOWLY DRAINING. REPAIR LEAKING FAUCET AT THREEE COMPARTMENT SINK | 41. PREMISES MAINTAINED FREE OF LITTER, UNNECESSARY ARTICLES, CLEANING  EQUIPMENT PROPERLY STORED - Comments: ELEVATE ITEMS 6"" OFF THE FLOOR IN REAR STORAGE AREA",42.01196173188842,-87.69986787778176,"(42.01196173188842, -87.69986787778176)"
1106325,"MORELIA SUPERMARKET, INC.",MORELIA SUPERMARKET,1892862,Grocery Store,Risk 1 (High),7300 N WESTERN AVE,CHICAGO,IL,60645,09/13/2012,Complaint Re-Inspection,Pass w/ Conditions,"4. SOURCE OF CROSS CONTAMINATION CONTROLLED I.E. CUTTING BOARDS, FOOD  HANDLERS, UTENSILS, ETC - Comments: SOURCE OF CONTAMINATION: WE(MANAGER,EMPLOYEE AND MY SELF)OBSERVED COOKED CHICKEN IN A LARGE POT, MIXED WITH THE COOKED CHICKEN WAS PLASTIC BAG  WITH LABEL,WHICH WAS COOKED WITH THE FOOD,ALSO OBSERVED RAW PEPPER STEMS, AND OTHER UNKNOWN PARTICLES. INFORMATION GIVEN ON SOURCE OF CONTAMINATION,AND HOW TO KEEP FOOD PROTECTED.FOOD DISCARDED AND DENATURED.POUNDS 40,VALUE 51.60.CRITICAL VIOLATION: 7-38-005(A) | 14. PREVIOUS SERIOUS VIOLATION CORRECTED, 7-42-090 - Comments: PREVIOUS SERIOUS VIOLATION NOT CORRECTED FROM 9-5-2012, REPORT# 1235043  #16-  OUTSIDE WALK-IN FREEZER RAW FOOD NOT PROTECTED:OBSERVED FOOD STORED ON FLOOR ON TOP ENCRUSTED BLOOD,OPENED VARIOUS KIND OF FOOD STORED INSIDE OPENED BOXES AND ON TOP THE WIRE SHELVES, EXPOSED FOOD INSIDE THE UNIT HAD A BUILD-UP OF ICE MIXED WITH FOOD. INSTRUCTED TO PROVIDE FOOD GRADE BAGS/CONTAINERS WITH LIDS TO STORE FOOD PRODUCTS,FOOD MUST BE ELEVATE 6"" OFF THE FLOOR.     STILL TODAY 9-13-12 OBSERVED FOOD NOT COVERED STORED ON FLOOR( SOUTH-EAST CORNER OF THE WALK-IN FREEZER),BOXES WITH RAW MEAT BROKEN AND DRIPPING DRIED BLOOD ON BOXES AND FLOOR. PRESENTLY EMPLOYEE ARE RE-ORGANIZING WALK-IN FREEZER,BOXES WAS REMOVED AND FOOD WAS PROPERLY STORE ON SHELVES.    OUTER OPENINGS NOT PROTECTED. OBSERVED REAR EXIT DOOR BY THE DEEP FRYER NOT RODENT/INSECTS PROOF,GAPS OF 1 TO 2"" ON BOTTOM OF DOORS. OBSERVED SMALL FLIES AND HOUSE FLIES THROUGHOUT THE PREP AREAS AND STORAGE.INSTRUCTED TO RODENT/INSECT PROOF REAR DOOR,ALSO REMOVE FLIES(APPROX 20 FLIES).    STILL TODAY 9-13-12 OBSERVED THE REAR DOOR NOT COMPLETELY RODENT/INSECT PROOFED.EVEN THOUGHT HOUSE FLIES AREA MINIMIZED STILL OBSERVED 10 OR MORE FLIES AT DELI DEPARTMENT. PRESENTLY EMPLOYEE ARE REPAIRING BOTTOM AND BETWEEN SAID DOOR. MANAGER CONTACT PEST CONTROL   CRITICAL VIOLATION:7-42-090 | 16. FOOD PROTECTED DURING STORAGE, PREPARATION, DISPLAY, SERVICE AND TRANSPORTATION - Comments: VIOLATION UP GRADED TO A CRITICAL VIOLATION #14.CDI. | 18. NO EVIDENCE OF RODENT OR INSECT OUTER OPENINGS PROTECTED/RODENT PROOFED, A WRITTEN LOG SHALL BE MAINTAINED AVAILABLE TO THE INSPECTORS - Comments: VIOLATION UP GRADED TO A CRITICAL VIOLATION #14, CDI.   | 32. FOOD AND NON-FOOD CONTACT SURFACES PROPERLY DESIGNED, CONSTRUCTED AND MAINTAINED - Comments: OBSEREVD KNIFE STORED BETWEEN WALL AND PREP TABLE,INSTRUCTED TO PROVIDE A KNIFE RACK AT REAR PREP/COOKING AREA   PROVIDE LIDS FOR ALL MEAT AND SAUCE BARRELS INSIDE THE WALK-IN MEAT COOLER.  OBSERVED INTERIOR PANELS OF ICE MACHINE IS BROKE,AND INSULATION IS EXPOSED, INSTRUCTED TO REPLACE.ICE IS USED FOR FRESH FISH   | 33. FOOD AND NON-FOOD CONTACT EQUIPMENT UTENSILS CLEAN, FREE OF ABRASIVE DETERGENTS - Comments: DETAIL CLEAN INSIDE THE MEAT BARRELS STORED INSIDE THE MEAT COOLER. CONTAINERS HAVE EXCESS DRY FOOD.CLEAN ALL WIRE SHELVES STORED IN COOLERS,WALK-IN COOLERS AND WALK-IN FREEZERS,ENCRUSTED FOOD DEBRIS AND NON-FOOD DEBRIS. REMOVE EXCESS GREASE FROM INSIDE THE DEEP FRYERS IN REAR PREP AREA AND BAKERY. | 34. FLOORS: CONSTRUCTED PER CODE, CLEANED, GOOD REPAIR, COVING INSTALLED, DUST-LESS CLEANING METHODS USED - Comments: KEEP FLOOR DRY INSIDE THE WALK-IN MEAT COOLER,EXCESS WATER ON FLOOR.  REGROUT FLOOR IN REAR PREP AREA AND DELI DEPARTMENT    | 34. FLOORS: CONSTRUCTED PER CODE, CLEANED, GOOD REPAIR, COVING INSTALLED, DUST-LESS CLEANING METHODS USED - Comments: MUST CLEAN INSIDE ALL WALK IN COOLER AND WALK IN FREEZER AND MAINTAIN | 35. WALLS, CEILINGS, ATTACHED EQUIPMENT CONSTRUCTED PER CODE: GOOD REPAIR, SURFACES CLEAN AND DUST-LESS CLEANING METHODS - Comments: NEED TO REMOVE PAPER LINER FROM METAL SHEETS BEHIND CONVENTIONAL OVEN IN PREP AREA. NEED TO PROVIDE WALL BEHIND THE DEEP FRYER BY THE REAR DOOR AND REPLACE WALL AROUND THE HOT WATER TANK IN REAR AREA, SURFACE MUST BE SMOOTH,CLEANABLE AND NON-ABSORBENT MATERIAL. RE-INSTALL ELECTRICAL BOX TO WALL BEHIND THE STOVE.   | 35. WALLS, CEILINGS, ATTACHED EQUIPMENT CONSTRUCTED PER CODE: GOOD REPAIR, SURFACES CLEAN AND DUST-LESS CLEANING METHODS - Comments: STAINED CEILING TILES IN THE STORAGE ROOM AND LADIES WASHROOM, DAMAGED CEIILING TILES IN THE MENS WASHROOM, MUST REPAIR/REPLACE. WALLS BY THE 3 COMPARTMENT, BY THE PREP TABLES,SINK NEEDS DETAIL CLEANING.   | 36. LIGHTING: REQUIRED MINIMUM FOOT-CANDLES OF LIGHT PROVIDED, FIXTURES SHIELDED - Comments:  REPLACE BROKEN LIGHT SHIELD ABOVE FRESH APPLES IN SELLING AREA.CLEAN INSIDE THE LIGHT SHIELD THROUGHOUT THE PREMISES, DUST AND DEAD INSECTS | 37. TOILET ROOM DOORS SELF CLOSING: DRESSING ROOMS WITH LOCKERS PROVIDED: COMPLETE SEPARATION FROM LIVING/SLEEPING QUARTERS - Comments: TOILET DOOR MUST BE SELF CLOSING AT STAFF WASHROOM IN REAR/STORAGE AREA | 38. VENTILATION: ROOMS AND EQUIPMENT VENTED AS REQUIRED: PLUMBING: INSTALLED AND MAINTAINED - Comments: WASTE LINE CONNECTION FROM THE WALK-IN COOLER MUST BE PROPERLY CONNECTED SUCH THAT IT DRAINS DIRTECTLY INTO A FLOOR DRAIN, DELI DEPARTMENT",42.01418398285244,-87.69037834981988,"(42.01418398285244, -87.69037834981988)"
1106328,7-ELEVEN,7-ELEVEN,1766607,Grocery Store,Risk 2 (Medium),6001 N WESTERN AVE,CHICAGO,IL,60659,09/14/2012,Complaint Re-Inspection,Pass,"33. FOOD AND NON-FOOD CONTACT EQUIPMENT UTENSILS CLEAN, FREE OF ABRASIVE DETERGENTS - Comments: CLEAN INSIDE THE TWO COMPARTMENT SINK,DEBRIS,DISH ROOM   | 34. FLOORS: CONSTRUCTED PER CODE, CLEANED, GOOD REPAIR, COVING INSTALLED, DUST-LESS CLEANING METHODS USED - Comments:  ELEVATE ITEMS 6"" OFF THE FLOOR IN DISH ROOM/OFFICE.   | 35. WALLS, CEILINGS, ATTACHED EQUIPMENT CONSTRUCTED PER CODE: GOOD REPAIR, SURFACES CLEAN AND DUST-LESS CLEANING METHODS - Comments:  REMOVE SPILLAGE ON WALL BEHIND THE JUICE RACK, BY THE TWO COMPARTMENT SINK.",41.990591264484515,-87.68952828959665,"(41.990591264484515, -87.68952828959665)"
1106329,ST. MARGARET MARY SCHOOL,ST. MARGARET MARY SCHOOL,1710,School,Risk 1 (High),7318 N OAKLEY,CHICAGO,IL,60645,09/14/2012,Canvass,Fail,"16. FOOD PROTECTED DURING STORAGE, PREPARATION, DISPLAY, SERVICE AND TRANSPORTATION - Comments: FOOD NOT PROTECTED DURING STORAGE. OBSERVED INTERIOR OF ICE MACHINE, BOTTOM PART(ICE BIN CONTAINER) WITH BLACK SLIME SUBSTANCE  DRIPPING ON ICE INSTRUCTED TO CLEAN, AND SANITIZE UNIT.  SERIOUS VIOLATION:7-38-005(A) | 18. NO EVIDENCE OF RODENT OR INSECT OUTER OPENINGS PROTECTED/RODENT PROOFED, A WRITTEN LOG SHALL BE MAINTAINED AVAILABLE TO THE INSPECTORS - Comments: OBSERVED EVIDENCE OF RODENT DROPPINGS IN DIFFERENT LOCATIONS OF PREMISES:BEHIND THE CHEST FREEZERS,ON FLOOR BY THE CABINET,BETWEEN WALLS OF FRAME DOOR AT STAGE AREA,ON WINDOW OF STAGE,INSIDE THE TEACHER STORAGE ROOM IN BASEMENT AREA AND IN ENGINEER BOILER ROOM.(APPR.30 OR MORE DROPPINGS). INSTRUCTED TO REMOVE DROPPINGS,AND SANITIZE AREA. NEED TO SEAL HOLES AND BROKEN WALL BEHIND THE MOP SINK,ELEVATE ITEMS IN TEACHERS STORAGE ROOM.OUTER OPENING NOT PROTECTED, NEED TO RODENT/INSECTS PROOF MAIN DOORS AT GYM BUILDING,WHICH A KITCHEN/CONCESSION ROOM ,WASHROOMS ARE PROVIDED.GAPS OF 1/2"" TO 1""AT BOTTOM  AND IN BETWEEN DOORS.  SERIOUS VIOLATION:7-38-020 | 33. FOOD AND NON-FOOD CONTACT EQUIPMENT UTENSILS CLEAN, FREE OF ABRASIVE DETERGENTS - Comments: REMOVE ICE BUILD-UP AND ENCRUSTED ICE  INTERIOR OF WHITE CHEST FREEZER BY THE WHITE REFRIGERATOR IN KITCHEN. | 34. FLOORS: CONSTRUCTED PER CODE, CLEANED, GOOD REPAIR, COVING INSTALLED, DUST-LESS CLEANING METHODS USED - Comments: ELEVATE 6"" OFF THE FLOOR ART CRAFT AND OTHER ITEMS FROM STORAGE IN CLASS ROOM #21. | 38. VENTILATION: ROOMS AND EQUIPMENT VENTED AS REQUIRED: PLUMBING: INSTALLED AND MAINTAINED - Comments: FOUND WASHBOWLS AT GIRLS AND BOY'S WASHROOMS IN GYM BUILDING NOT STAYING ACTIVATED  FOR A LEAST 15 SECONDS, MUST REPAIR SO WATER CAN STAY FLOWING AT LEAST 15 SECONDS.",42.01466042299597,-87.6876773450303,"(42.01466042299597, -87.6876773450303)"
1106340,ST. MARGARET MARY SCHOOL,ST. MARGARET MARY SCHOOL,1710,School,Risk 1 (High),7318 N OAKLEY,CHICAGO,IL,60645,09/24/2012,Canvass Re-Inspection,Pass,"34. FLOORS: CONSTRUCTED PER CODE, CLEANED, GOOD REPAIR, COVING INSTALLED, DUST-LESS CLEANING METHODS USED - Comments:  ELEVATE 6"" OFF THE FLOOR ART CRAFT AND OTHER ITEMS FROM STORAGE IN CLASS ROOM #21.   | 38. VENTILATION: ROOMS AND EQUIPMENT VENTED AS REQUIRED: PLUMBING: INSTALLED AND MAINTAINED - Comments:  FOUND WASHBOWLS AT GIRLS AND BOY'S WASHROOMS IN GYM BUILDING NOT STAYING ACTIVATED FOR A LEAST 15 SECONDS, MUST REPAIR SO WATER CAN STAY FLOWING AT LEAST 15 SECONDS.   | 38. VENTILATION: ROOMS AND EQUIPMENT VENTED AS REQUIRED: PLUMBING: INSTALLED AND MAINTAINED - Comments: NEED TO PROVIDE A BACK FLOW DEVICE AT WATER LINE AT ICE MACHINE.",42.01466042299597,-87.6876773450303,"(42.01466042299597, -87.6876773450303)"
